Title,Contents,link
"[단독]기업은행 직원, 76억 '셀프 대출'로 부동산 29채 쇼핑",국책은행인 기업은행의 한 직원이 최근까지 자신의 가족 앞으로 76억원어치 부동산 담보대출을 실행해 개인 이득을 취했다가 면직 처분 됐다 이 직원은 정부가 부동산 규제 정책을 쏟아내는 시기에 경기 화성의 한 지점에 근무하면서 은행의 담보대출을 활용해 화성 일대 아파트오피스텔연립주택 등 29개 부동산을 사들였다 평가차익만 50억60억원 수준으로 알려졌다 기업은행 전경 중앙포토  ━29개 부동산 사들이며 76억 대출한 기업은행 직원  윤두현 미래통합당 의원실이 1일 기업은행으로부터 받은 대출취급의 적정성 조사 관련 문건에 따르면 기업은행 A차장은 2016년 3월부터 올해 상반기까지 사실상 자기 앞으로 29건 75억7000만원어치 부동산 담보대출을 실행했다 최근까지 서울의 한 지점에서 근무한 A차장은 경기 화성의 한 지점에서 근무하던 당시 주로 부동산을 사들인 것으로 알려졌다 윤두현 미래통합당 의원실이 1일 기업은행으로부터 받은 대출취급의 적성성 조사 관련 문건 윤두현 의원실A차장은 가족 명의를 앞세워 부동산 쇼핑에 나섰다 그가 대출을 실행한 상대방은 자신의 아내모친 등 가족이 대표이사로 있는 법인기업 5개와 개인사업자였다 법인기업 5개엔 총 26건 73억3000만원어치 부동산 담보대출을 내줬고 개인사업자엔 총 3건 2억4000만원어치 부동산 담보대출을 내줬다 ━정부 부동산 규제 때 주거용 부동산 29건 쇼핑  A차장이 실행한 부동산담보대출 총 29건의 담보물은 아파트와 오피스텔 연립주택 등 주로 경기도 일대에 위치한 주거용 부동산이었다 아파트의 경우 경기 화성에 위치한 아파트 14건을 포함해 총 18건이었고 오피스텔 역시 경기 화성에 위치한 오피스텔 8건 등 총 9건 연립주택은 경기 부천에 위치한 2건이었다A차장이 본격적으로 가족 명의 회사 등에 부동산 담보대출을 실행한 시기는 현 정부가 부동산 규제 정책을 쏟아냈던 때와 겹친다 정부는 2017년 6월 19일 주택시장의 안정적 관리를 위한 선별적맞춤형 대응방안을 발표한 이후 지난달 4일 서울권역 등 수도권 주택공급 확대방안을 발표하기까지 총 23건의 크고 작은 규제정책을 쏟아내면서 부동산 투기 제한에 총력을 쏟았다 정부가 다주택자의 주택담보대출을 조이는 정책을 연이어 낼 때 국책은행인 기업은행 직원은 셀프 대출’을 통해 부동산 투기에 나서 막대한 이득을 챙긴 것이다  정부는 지난달까지 크고 작은 부동산 대책을 23차례 발표했다 김현미 국토교통부 장관이 31일 오전 서울 여의도 국회에서 열린 국토교통위원회 전체회의에서 발언하고 있다 연합뉴스  ━면직 처분 했지만 꼬리자르기 지적도  한달 넘게 A차장 사건을 검사한 기업은행은 이날 A차장을 면직 처분하기로 하고 관련 공문을 사내에 게재했다 하지만 기업은행 내부에선 회사 측이 A차장에 대한 징계로 꼬리자르기에 나선 것 아니냐는 얘기가 나온다 A차장이 76억원어치 부동산 담보대출을 가족 명의 회사 등으로 흘려보낼 때 이를 실행할 수 있도록 승인해준 당시 지점장 등에 대해선 어떤 처분이 있었는지 알 수 없어서다 은행 지점의 대출은 지점장의 승인 없이 실행될 수 없다  이에 대해 기업은행 관계자는 해당 차장은 여신 업무 처리절차를 준수하지 않은 데다 자기 이익을 대변하지 않는다는 은행원의 품위 유지 관련 내부 코드 바른경영이라는 핵심가치 등에 반하는 행동을 했기 때문에 면직 처분을 내린 것이라며 당시 지점장에 대한 징계 여부는 개인의 인사정보라서 공개적으로 밝힐 수 없다라고 말했다 ━평가차익 5060억원 추정내부절차 규정 허점최근 수도권의 부동산 가격이 폭등하면서 A차장이 담보대출을 통해 사들인 부동산의 평가차익도 50억60억원 수준에 달하는 것으로 알려졌다 다만 A차장이 해당 담보물 가운데 몇 건을 처분해 이 중 얼마를 이익으로 실현했는지 평가액이 어떻게 변동했는지는 공개되지 않아 정확한 액수를 알 수는 없다 A차장에 대한 면직을 결정한 기업은행은 차후 절차에 따라 부동산 담보대출을 회수하는 등 후속 대처에 나설 계획이다  윤두현 의원은 현 정부의 부동산 폭등 정책으로 온 국민이 박탈감과 스트레스를 많이 받고 있는 상황에서 이런 문제가 발생해서 심히 유감이라며 국책은행인 기업은행은 다른 시중은행보다 내부통제기준이나 직원 개개인의 내부절차 규정이 더 잘 지켜져야 함에도 이런 문제가 발생하도록 뒀다는 것은 규정의 허점이 있었기 때문이라고 말했다  정용환 기자 jeongyonghwan1joongangcokr넌 뉴스를 찾아봐 난 뉴스가 찾아와 그래서 팩트가 뭐야 궁금하면 팩플 세상 쉬운 내 돈 관리 그게머니ⓒ중앙일보httpsjoongangcokr 무단 전재 및 재배포 금지,https://news.naver.com/main/ranking/read.nhn?mid=etc&sid1=111&rankingType=popular_day&oid=025&aid=0003031086&date=20200901&type=1&rankingSectionId=101&rankingSeq=3
마통 만들고 돈 빌리고…카카오게임즈 청약 첫날 16조 몰려,변동성 커진 증시 환경 속 청약 첫날 경쟁률 4271개인투자자 대출 받는 등 주식배정 위한 현금 확보전직장인 김아무개29씨는 하반기 기업공개IPO 시장의 기대주로 꼽히는 카카오게임즈 일반 공모주 청약 신청을 위해 1일 은행에서 1억원 대출을 급히 신청했다 김씨는 지난달 에스케이SK바이오팜의 주가 상승을 지켜본 뒤 신규 상장 주식에 부쩍 관심을 갖게 됐다 김씨는 “지난번엔 넣은 돈이 적어 배정을 못 받았지만 이번엔 꼭 성공하고 싶다”며 “지금과 같은 유동성 장세에 이 정도 미래가치가 있는 기업이면 주가 상승 가능성이 높다고 봤다”고 말했다1일부터 이틀 동안 진행되는 카카오게임즈 공모주 청약 신청에 투자자 관심이 뜨겁다 첫날 경쟁률이 427451을 기록했고 증거금은 16조4천억원에 이르렀다 에스케이바이오팜 공모 당시 총 증거금30조9889억원의 절반 이상이 첫날에 몰린 것이다 이날 오전 한때 투자자들이 몰리면서 삼성증권 온라인 공모 청약은 15분 가량 중단되기도 했다 투자자 커뮤니티에선 김씨처럼 마이너스 통장을 뚫었다’거나 지인 돈을 빌렸다’는 등의 게시글이 속속 올라왔다 카카오게임즈는 프렌즈타운 도라에몽파크 등 카카오 지적재산권IP 기반의 자체 개발 게임을 보유한 게임회사다 최근 사전 예약자가 320만명 몰린 모바일 다중접속역할수행MMORPG 게임 달빛조각사’도 카카오페이지의 인기 웹소설 아이피를 활용해 만들어졌다 이외에도 배틀그라운드 등 다른 게임제작사가 만든 피씨PC게임을 카카오게임’이라는 모바일 플랫폼을 통해 소개한다기관투자자 수요예측에서도 열기가 뜨거웠다 지난달 26일 수요예측에 참여한 1745개 기관 가운데 1366개78는 공모가액인 2만4천원보다 높은 가격에 주식을 신청했고 경쟁률도 1478531로 역대 최고였다 공모가가 4만9천원이었던 에스케이SK바이오팜8361을 훨씬 넘어서는 경쟁률이다 기관투자자 가운데 557는 주식을 우선적으로 배정받기 위해 최소 15일에서 최대 6개월까지 카카오게임즈 주식을 매도하지 않기로 약속의무보유확약했다최근 증시가 2300선에서 등락을 반복하고 카카오 네이버 등 기존 인터넷 기업의 상승 폭도 둔화되면서 투자자들의 관심은 신규 상장 주식으로 옮겨가고 있다 아직 시장 적정가가 형성되지 않았으니 투자자 기대감으로 일명 따상시초가 두 배 형성 후 상한가’도 가능하다고 본 것이다 공모주는 청약 증거금을 많이 넣을수록 주식을 많이 배정 받는 구조라 현금 확보가 필수다 만약 경쟁률이 1000대 1이라면 1000만원을 넣어야 한 주를 받을 수 있다 배정 주식 수를 늘리려는 개인투자자들이 현금 확보전을 벌이는 이유다 그러나 카카오게임즈에 거는 시장 기대가 과도하다는 반박도 있다 상장 주관사를 맡은 한국투자증권과 삼성증권은 연매출 3900억원인 카카오게임즈를 중국 텐센트 홀딩스와 넷마블 엔씨소프트 넷이즈NetEase와 견줘 평가했는데 이들 기업의 지난해 연 매출은 최소 1조7천억원에서 최대 62조원에 이른다 카카오게임즈 주가가 지나치게 높게 책정됐다고 평가하는 이들이 많아지면 장기적으로 주가가 하락할 수 있다 김진구 케이티비KTB 연구위원은 “카카오게임의 자체개발 비중이 낮고 플랫폼 주요 콘텐츠인 검은사막의 북미유럽시장 재계약에 변수가 있어 2만8천원 이상으로 가치를 부여하기는 어렵다”고 판단했다신다은 기자 downyhanicokr더불어 행복한 세상을 만드는 언론 한겨레 구독하세요네이버 채널 한겨레21 구독2005년 이전 한겨레 기사 보기ⓒ한겨레신문  무단전재 및 재배포 금지,https://news.naver.com/main/ranking/read.nhn?mid=etc&sid1=111&rankingType=popular_day&oid=028&aid=0002511100&date=20200901&type=1&rankingSectionId=101&rankingSeq=4
“3번이나 음성 받았다! 그만 괴롭혀”… 자가격리 위반 고발당한 민경욱의 항변,민 전 의원 “솔직히 말해라 부정선거 자꾸 외치니 무섭다고” 민경욱사진 미래통합당 전 의원이 신종 코로나바이러스 감염증코로나19 확산 방지를 위한 자가격리 중 무단 이탈해 경찰에 고발당했다 그러나 “3번이나 음성 판정 받은 사람을 자가격리시킬 수 있는 법적 근거를 대보라”고 반발했다민 전 의원은 1일 오후 사회관계망서비스SNS에 “변호사들이 한참을 찾고 내린 결론은 음성 판정을 받은 사람에게 자가격리 명령을 내릴 수 있는 권한은 그 어디에도 없다는 것”이라며 이같이 적었다민 전 의원은 “2번이나 자발적인 검사를 받아서 모두 음성 판정을 받은 나를 고발하겠다고 솔직히 말해라 부정선거 자꾸 외치니 무섭다고”라고 덧붙였다  민경욱 페이스북 갈무리 또 다른 글에서 그는 “내게 자가격리를 하라는 보건소 최모 과장에게 전화를 했을 때 음성이라는 걸 모른 상태에서 고지가 잘못 나갔다는 취지의 발언을 하고 그날 음성이라는 증명까지 다시 보내줘놓고 뭐 고발”이라고 발끈했다그러면서 인천 연수구 보건소로부터 지난달 17일과 20일 24일 3차례 받은 문자 메시지를 공개하며 “무려 세 번에 걸쳐 나에게 코로나 음성이라고 통보한 연수구 보건소가 나를 자가격리 위반으로 고발했다는 게 이해가 되는가”라고 되물었다민 전 의원은 보건소 측에 “저는 연수구 보건소가 발급한 음성 판정 통지문을 받은 사람이다 더 이상 괴롭히면 의법조치하겠다”라는 문자 메시지를 보낸 사실을 밝히며 “저는 이런 경고까지 했었다”고 했다인천시 연수구는 이날 감염병 예방 및 관리에 관한 법률 위반 혐의로 민 전 의원을 경찰에 고발했다민 전 의원은 지난달 22일 자가격리 담당 공무원이 집에 찾아갔을 당시 자리를 비운 것으로 전해졌다코로나19 시국 속 정부의 자가격리 수칙’을 위반하면 1년 이하의 징역 또는 1000만원 이하의 벌금에 처해진다  이재정 더불어민주당 의원왼쪽 최현 박주민 당대표 선거대책본부 기획상황실장이 지난달 21일 오후 서울 종로구 서울지방경찰청 앞에서 광복절 집회와 관련해 민경욱 전 의원 등을 감염병예방법 위반 혐의 등으로 고발하기 위해 민원실로 향하고 있다 연합뉴스 민 전 의원은 광복절인 지난달 15일 서울 광화문이 아닌 을지로에서 415 부정선거 규탄집회를 벌였고 스스로 코로나19 검사 결과 음성 판정을 받았다고 밝힌 바 있다이후 민 전 의원은 코로나19 집단 감염이 발생한 서울 성북구 사랑제일교회 관련 접촉자로 분류돼 보건당국으로부터 자가격리 통보를 받았다한편 박주민 더불어민주당 의원은 지난달 21일 민 전 의원 등을 감염병예방법 위반 혐의로 경찰에 고발하겠다고 밝혀 눈길을 끌었다당시 박 의원은 KBS 라디오 김경래의 최강시사’에 출연해 민 전 의원의 집회에 대해 “법원의 행정명령 효력정지 결정에 따라 열린 집회지만 실제 진행된 집회는 법원이 인정한 범위를 넘어섰다”라고 주장했다이에 민 전 의원은 당시 을지로에서 열린 부정선거 규탄집회는 합법적으로 진행된 것이라고 반박했다현화영 기자 hhysegyecom  사진연합뉴스ⓒ 세상을 보는 눈 세계일보,https://news.naver.com/main/ranking/read.nhn?mid=etc&sid1=111&rankingType=popular_day&oid=022&aid=0003499201&date=20200901&type=1&rankingSectionId=102&rankingSeq=3
"설훈 ""추미애 아들, 군대 안 가도 되는데 갔다…오히려 칭찬해야""",  설훈 더불어민주당 의원 임현동 기자더불어민주당 설훈 의원이 추미애 법무부 장관 아들 서모씨의 군 휴가 미복귀 특혜 의혹과 관련해 도리어 서씨를 칭찬해야 한다고 주장했다 “군에 안 갈 수 있는 사람인데도 군에 갔다는 사실이 상찬되지 못할망정 문제 삼는다는 건 이해하기 어렵다”면서다  1일 국회 국방위원회 전체회의에선 서씨가 군 복무 중 특혜를 받았다는 의혹과 관련해 정경두 국방부 장관에게 질문이 쏟아졌다 그러자 설 의원 등 민주당 의원들이 방어에 나섰다  육군 중장 출신인 미래통합당 신원식 의원이 포문을 열었다 그는 “휴가 23일 중 19일이 병가고 군의관의 소견 필요한데 그 기록 없다 그냥 나간 게 아니냐”고 정 장관에게 물었다 정 장관은 “절차에 따라 병가와 휴가가 진행됐다”면서도 “행정처리가 정확하게 되지 못했다”고 답했다신 의원은 “군의관 소견이 병무청 자료에도 없고 기록에도 없다”고 재차 지적했고 정 장관은 “지휘관이 구두 승인을 했더라도 휴가 명령을 내게 돼 있는데 서류상에는 그런 것들이 안 남겨져 있다”면서 “행정 절차상에는 오류가 있을 수 있다”고 설명했다 절차를 밟진 않았지만 지휘관이 구두 승인했고 그렇다면 법적으로는 문제가 없다는 취지다  신 의원의 질의 뒤 민주당 의원들은 정치공세라며 맞섰다 이 과정에서 서씨를 옹호하는 설 의원의 발언이 나왔다설 의원은 “서 일병특혜 의혹 당시 서씨의 계급은 무릎 수술을 해서 군에 안 갈 수 있는 조건인데도 어머니의 사회적 위치 때문에 가겠다고 결정한 것으로 알고 있다”며 “이 문제특혜 의혹를 가지고 무슨 위원회를 새로 만든다 어쩐다 하는 이야기는 지나친 정치적 공세”라고 주장했다 그는 이어“군에 안 갈 수 있는 사람인데도 군에 갔다는 사실 자체가 상찬賞讚기리어 칭찬함되지는 못할망정 문제 삼는다는 건 이해하기 어렵다”고 말했다  이에 신 의원은 “서 씨가 군에 안 갈 수 있는데 왔다’는 것과는 무관한 일”이라며 “병가를 가려면 먼저 군의관이 진단해보고 군에서 도저히 치료하기 불가능하다는 판단이 나오면 소견서를 쓰고 지휘관에게 보고하면 지휘관이 OK 사인을 해야 하는 것”이라고 말했다 신 의원은 또 “서 일병은 진단서도 없고 아무런 근거가 없다 명령 자체도 안 났다 그래서 문제를 제기하는 것”이라고 덧붙였다  홍주희 기자 honghongjoongangcokr넌 뉴스를 찾아봐 난 뉴스가 찾아와 그래서 팩트가 뭐야 궁금하면 팩플 세상 쉬운 내 돈 관리 그게머니ⓒ중앙일보httpsjoongangcokr 무단 전재 및 재배포 금지,https://news.naver.com/main/ranking/read.nhn?mid=etc&sid1=111&rankingType=popular_day&oid=025&aid=0003031314&date=20200901&type=1&rankingSectionId=100&rankingSeq=3
나도 근로장려금 받나…맞벌이 최대 105만원,머니투데이 세종박준식 기자  세종뉴시스강종민 기자  이청룡 국세청 소득지원국장이 27일 오전 정부세종2청사에서 2019년 정기분 근로장려금자녀장려금 신청에 대해 브리핑 하고 있다 20200427ppkjmnewsiscom국세청은 올해 상반기에 근로소득이 있는 137만 저소득 가구에 근로장려금 신청 안내문을 발송해 심사를 거쳐 12월 지급할 예정이라고 1일 밝혔다상반기 근로장려금 신청기간은 이달 15일까지로 이번에 신청하지 못한 경우에는 내년 3월하반기분 신청이나 5월정기분 신청에 신청해도 된다신청은 코로나19 감염 예방을 위해 4가지 비대면 수단을 활용해 세무서 방문 없이 간편히 진행할 수 있다 4가지는 ①자동응답시스템15449944로 전화 후 안내에 따라 ②손택스홈택스 앱 설치 ③홈택스인터넷에서 홈택스를 조회 ④전화장려금 전용 전화상담사 요청 등이다 ━배우자 소득 연 300만원 이하면 홑벌이━상반기 지급신청은 반기지급제도에 따른 것으로 근로소득 발생시점2020년과 근로장려금 지급시점2021년 9월간 기간을 단축해 소득지원 효과를 높이려 지난해 도입됐다 근로소득자에 한해 해당연도 반기분 소득을 기준으로 근로장려금을 반기별로 신청받아 지급하는 제도다 근로장려금은 1가구에 1명만 지급받을 수 있으며 지급대상은 배우자･부양가족 유무에 따라 단독･홑벌이･맞벌이가구로 구분된다 단독 가구는 배우자와 부양자녀 70세 이상 직계존속이 없는 가구이고 홑벌이 가구는 배우자총급여액 등이 300만원 미만나 부양자녀 또는 70세 이상 직계존속이 있는 가구각각 연간 소득금액이 100만원 이하로 정의할 수 있다 마지막으로 맞벌이 가구는 신청인과 배우자 각각의 총급여액 등이 300만원 이상인 가구다━맞벌이 최대 연3600 미만 신청가능재산 2억 이하━국세청은 근로장려금을 신청할 수 있는 자격이 소득기준으로는 전년 부부합산 총소득 및 금년 근로소득이 가구 구분에 따른 기준금액에 속해야 한다고 설명했다 기준금액은 △단독 가구 4만2000만원 미만 △홑벌이 가구 4만3000만원 미만 △맞벌이 가구 600만3600만원 미만이다 여기에 재산 기준은 부동산과 자동차 예금 등 가구원 전체 재산 합계액이 2억원 미만이다 또 부채는 재산에서 차감하지 않는 것이 기준이다 자신의 실제 기준재산은 근로장려금을 신청하면 심사를 위해 가구원에 대한 금융조회로 평가되므로 스스로 증명할 필요는 없다국세청은 이번 반기지급을 통해 연간 근로장려금 산정액의 35를 지급하며 최대지급액은 맞벌이 가구의 경우 105만원이다 구체적으로 △단독 가구는 15만52만5000원 △홑벌이는 15만91만원 △맞벌이는 15만105만원이다 국세청 소득지원국은 2020년도 중 가구원 재산 등의 변동으로 2021년 9월 정산시 지급액이 감소하거나 지급 제외되는 경우 향후 5년간 지급할 장려금에서 차감될 수 있다며 재산 합계액이 1억4000만원 이상이거나 체납세액이 있는 경우에도 장려금이 감액되거나 세액으로 일부 충당된 후 지급된다고 설명했다세종박준식 기자 win0479mtcokr줄리아 투자노트조 변호사의 가정상담소 머니투데이 구독하기 저작권자 ⓒ 돈이 보이는 리얼타임 뉴스 머니투데이 무단전재 및 재배포 금지,https://news.naver.com/main/ranking/read.nhn?mid=etc&sid1=111&rankingType=popular_day&oid=008&aid=0004464361&date=20200901&type=1&rankingSectionId=101&rankingSeq=5
