Title,Contents,link
"美 테슬라 ""50억달러 유상증자 한다""",미 SEC 제출 서류 통해 밝혀사진AP연합뉴스미국 전기차기업 테슬라가 50억달러약 5조9240억원 규모 유상증자에 나선다고 1일현지시간 밝혔다CNBC에 따르면 테슬라는 이날 미국 증권거래위원회SEC에 제출한 서류를 통해 이같이 밝혔다 팩트셋에 따르면 이날 기준 테슬라 시가총액은 4640억달러 수준이다 SEC 서류에 따르면 테슬라는 골드만삭스 뱅크오브아메리카 등을 통해 추가 주식을 시장가로 신규 주식을 수시 발행할 예정이다 CNBC는 테슬라 주가가 액면분할 이후 급등하던 와중 이런 발표가 나왔다고 지적했다블룸버그통신은 테슬라가 최근 가격이 오른 와중 유상증자에 나서 자금을 마련하려 한다며 테슬라는 지난 2월엔 20억달러 규모 유상증자를 통해 전기차 대중화를 위한 현금 보유고를 마련했다고 보도했다 테슬라가 주식 매각을 통해 조달한 자금을 어디에 이용할 지 등에 대해선 알려지지 않았다 전날 테슬라는 지난달 11일 발표한 5대1 액면분할가 기준으로 첫 거래를 시작했다 이날 테슬라 주가는 전일대비 1257 급등한 49832달러에 장을 마쳤다테슬라는 지난달 11일 5 대 1의 액면분할을 발표한 뒤 이날까지 8128 급등했다한편 한국예탁결제원에 따르면 지난달 말 기준 국내 투자자의 테슬라 주식 보유 잔액은 36억7140만달러약 4조3430억원이다이는 테슬라 시가총액4124억9300만달러의 089에 해당하는 규모다 국내 투자자들이 보유한 테슬라 주식은 약 165만 주로 테슬라 10대 주주인 밤코사161만7010주087보다도 많다선한결 기자 alwayshankyungcom 믿고 보는 기자 한경 기자 코너 네이버에서 한국경제 뉴스를 받아보세요 모바일한경 구독신청 ⓒ 한국경제  hankyungcom 무단전재 및 재배포 금지,https://news.naver.com/main/ranking/read.nhn?mid=etc&sid1=111&rankingType=popular_day&oid=015&aid=0004408564&date=20200901&type=1&rankingSectionId=104&rankingSeq=1
"통합당 ""추미애 아들 질의 왜 막나""…법사위 15분만에 파행",1일 열린 국회 법제사법위원회 전체회의에서 여야가 충돌했다 추미애 법무부 장관 아들 서모27씨의 군 복무 시절 특혜 휴가 의혹에 대한 현안질의 여부를 두고서다  미래통합당 법사위 간사인 김도읍 의원이 1일 오후 서울 여의도 국회에서 열린 법제사법위원회 전체회의에서 윤호중 위원장에게 항의를 하고 있다 가운데는 백혜련 더불어민주당 간사뉴스1법사위는 이날 오후 전체회의에서 2019 회계연도 결산과 예비비지출 승인 안건을 의결했다 충돌은 그 이후 일어났다 더불어민주당 소속인 윤호중 법사위원장이 의결 후 회의를 마치려고 하자 통합당 의원들이 “왜 현안질의를 하지 않느냐”고 강하게 항의했다 윤 위원장은 “현안질의는 오늘 의사일정에 포함돼 있지 않고 양당 간사 간 협의나 사전 요청도 없었다”며 “다음 주에 하라”며 정회를 선포했다  이에 통합당은 별도 기자회견을 열었다 통합당 법사위 간사인 김도읍 의원은 “예산심사 의결을 마치고 나면 당연히 추미애 장관 아들 문제와 월성1호기 감사 문제 등 산적해 있는 현안에 대해 질의하려고 준비했는데 법사위원장이 갑자기 질의 기회를 박탈했다”며 “기관장을 불러놓고 회의하는데 현안 질의를 못 하게 막는 것은 폭거”라고 했다추미애 법무부 장관이 1일 국회에서 열린 법제사법위원회 전체회의에서 인사말을 하고 있다 연합뉴스통합당은 당초 이날 법사위에서 추 장관 아들 의혹에 대해 집중적으로 질의할 예정이었다 2017년 아들이 휴가에서 복귀하지 않았음에도 추 장관이 압력을 행사해 이를 무마했다는 게 야당의 주장이다 이날 오전에는 육군 중장 출신 신원식 통합당 의원이 제기했다 “추미애 의원 보좌관이라는 인물이 서씨 부대에 전화를 걸어 휴가 연장을 요청했다”는 진술을 사건을 수사 중인 서울동부지검에서 확보했다고 주장했다  김도읍 의원은 현안질의가 무산된 뒤 가진 기자회견에서 “추 장관 아들 문제는 군 조직이 개입돼 있다는 의혹이 제기되고 있고 이런 상황에서 추 장관의 일관된 변명에 대해 저희가 확인을 했었어야 했다”고 말했다 윤한홍 의원 역시 “검찰 수사가 많이 진행됐는데도 결과를 뭉개고 있으니 언론에서 관련 보도가 나오고 있다”며 “굉장히 중요한 새로운 사실이 나와서 현안질의를 해야만 한다”고 말했다반면 추 장관은 야당의 이같은 의혹을 완강히 부인하고 있다 추 장관은 이날 국회 예결위에 출석해서도 “의혹이 사실이라면 직권남용죄가 된다”는 박형수 통합당 의원 질의에 “보좌관이 뭐하러 사적인 지시를 받나 그런 사실이 없다”고 했다  통합당은 2일 기자회견 등을 통해 추가 의혹을 제기할 예정이다 김 의원은 “저와 우리 당 신원식 의원 법률지원단장인 정점식 의원이 추 장관 아들 의혹과 관련해 오전 10시쯤 국민께 보고 드릴 내용이 있을 것”이라며 “추가로 확인된 부분도 있고 고발하기 위해 준비 중인 것도 있다”고 밝혔다미래통합당 법제사법위원회 소속 의원들이 1일 오후 서울 여의도 국회에서 법사위 정회와 관련해 긴급기자회견을 하고 있다 뉴스1윤정민 기자 yunjmjoongangcokr넌 뉴스를 찾아봐 난 뉴스가 찾아와 그래서 팩트가 뭐야 궁금하면 팩플 세상 쉬운 내 돈 관리 그게머니ⓒ중앙일보httpsjoongangcokr 무단 전재 및 재배포 금지,https://news.naver.com/main/ranking/read.nhn?mid=etc&sid1=111&rankingType=popular_day&oid=025&aid=0003031284&date=20200901&type=1&rankingSectionId=100&rankingSeq=5
“LTE 무제한+기기값=월 8만원(갤노트20울트라)”…알뜰폰의 ‘선공!’ [IT선빵!],갤노트20 파격적인 LTE요금제 프로모션알뜰폰 업체의 선공 이통3사는 비싼 5G고수’헤럴드경제박지영 기자“갤노트20 울트라 LTE 무제한 요금제 사용하고 월 8만원에 가져 가세요”알뜰폰이 5세대G폰의 롱텀에볼루션LTE 요금제 가입에 굳게 문을 닫은 이동통신3사에 선공’을 날렸다 5G폰인 갤럭시노트20을 롱텀에볼루션LTE 요금제로 개통할 수 있는 서비스를 선보였다 소비자들이 지속적으로 요구했던 5G폰 LTE요금제 개통’을 이통3사가 아닌 알뜰폰이 스타트를 끊었다공시지원금도 50만60만원으로 파격적이다 갤럭시노트20 울트라의 출고가는 145만 2000원 30개월 약정 구매시 LTE 데이터를 무제한으로 사용하고도 기기값을 포함한 월 요금이 8만원대다 이통 3사 구매 시 고가 5G요금제와 짠물지원금’ 탓에 월 평균 요금은 14만원대24개월 약정다갤럭시노트20 출시 후 높아진 알뜰폰에 대한 관심을 파격적인 요금 정책으로 흡수하겠다는 전략이다 알뜰폰의 도발’에 이통3사가 어떻게 대응할 지 주목된다LTE 개통에 60만원 공시지원금까지알뜰폰 업체 스노우맨’이 1일 갤럭시노트20 울트라 모델을 LTE요금제로 개통할 수 있는 프로모션을 선보였다 스노우맨은 KT의 통신망을 임대해 통신서비스를 제공하는 세종텔레콤의 알뜰폰MVNO 브랜드다갤럭시S20 시리즈는 5G 요금제로만 개통할 수 있었던 것과 달리 갤럭시노트20 울트라는 LTE요금제 3종5G슬림 요금제 총 4가지로 개통할 수 있다 단 다음 달 31일까지만 진행되는 한시적 프로모션이다반면 이통3사는 갤럭시노트20을 5G요금제로만 가입할 수 있다 이통 3사의 5G 최저요금제청소년시니어 요금제 제외는 5만 5000원부터 시작한다 5G용 단말로 출시되는 최신 스마트폰을 LTE요금제로 사용하고자 하는 소비자들의 요구를 알뜰폰이 먼저 반영한 셈이다스노우맨은 공시지원금에 요금 할인까지 제공한다 데이터 무제한 요금제인 퍼플’ 요금제 가입 시 62만 7000원의 공시지원금을 적용30개월 약정한다 해당 요금제의 원래 가격은 6만 5890원이지만 프로모션 가입자에게는 5만 4890원에 제공한다 기기값을 포함한 월 청구요금이 8만 4453원이다이통3사의 갤럭시노트20 공시지원금은 짠물’이다 최저가 요금제의 경우 SK텔레콤과 KT가 10만원 LG유플러스가 9만 9000원의 지원금을 지급한다 10만원이 넘는 최고가 요금제 지급되는 지원금도 SK텔레콤 17만원 KT 24만원 LG유플러스 20만 1000원에 불과하다이 때문에 대부분의 소비자들은 기기값을 온전히 내고 대신 2년 간 25 요금을 할인 받는 선택약정’으로 갤럭시노트20 울트라를 구매한다 월 청구요금은 13만14만원 대데이터 무제한 요금제다 알뜰폰의 2배에 가까운 숫자다이통 3사 5G폰 LTE개방은 언제지난해 5G 상용화 이후 소비자들은 지속적으로 5G 스마트폰을 LTE요금제로도 사용할 수 있게 해달라고 요구해왔다 5G의 비싼 요금과 품질에 대한 불만이 컸기 때문이다 하지만 이통3사는 5G 단말기의 최초 개통은 5G 요금제로 해야한다’는 약관을 고수해 왔다이에 과학기술정보통신부는 지난 달 21일부터 자급제’ 단말기에 한해 LTE요금제로 첫 개통이 가능하도록 조치했다 통신사 제품은 여전히 첫 개통시 LTE 요금제 가입이 제한된다갤럭시노트20을 통신사에서 구매한다면 첫 개통은 반드시 5G 요금제로 해야한다 자급제 5G폰의 경우 이통3사에서 LTE로 개통할 수 있지만 이통사향 휴대폰이 아닌 탓에 공시지원금 등 혜택을 누릴 수 없다일부 소비자들은 이통사에서 5G단말기를 구입개통→ 유심 LTE단말기에 넣고 LTE요금제로 변경→다시 5G 단말기에 유심 삽입’하는 방법으로 LTE요금제를 사용하고 있다 휴대폰 분실 등 부득이하게 다른 스마트폰을 사용해야 할 경우를 대비해 마련된 유심기변을 우회한 방식이다 5G폰에서 곧바로 LTE요금제로 변경할 수 없는 탓에 번거로움을 감수하는 것이다이와 관련 이통3사측은 “당분간 5G폰을 LTE로 첫 개통할 수 있도록 방침을 변경할 계획은 없다”고 밝혔다parkjiyeongheraldcorpcom엄마들이 꼽은 NO1 화상영어무료체험헤럴드경제 네이버 채널 구독 농수축산물 소비캠페인  Copyrights ⓒ 헤럴드경제  heraldbizcom 무단 전재 및 재배포 금지 ,https://news.naver.com/main/ranking/read.nhn?mid=etc&sid1=111&rankingType=popular_day&oid=016&aid=0001719564&date=20200901&type=1&rankingSectionId=105&rankingSeq=5
“성관계 하고싶어져” 책 회수했다고  여당에 혼난 여가부,더불어민주당 의원들은 1일 여성가족부가 노골적인 성性 표현이 담긴 초등학생용 교재를 회수한데 대해 “정부 정책을 하루 아침에 바꾸나”라며 질타했다앞서 미래통합당 김병욱 의원은 여가부가 일부 초등학교에 배포한 성교육 서적이 “성관계 하고싶어져” “재미있거든” 등의 과도한 표현과 남녀의 성기 묘사 등을 담고 있다고 지적했다 하지만 이에 대해서는 진보 층 일각에서 “해외에서 호평을 받은 교재”라는 반론도 나왔었다민주당 신동근 의원은 1일 여성가족위 전체회의에서 이정옥 여성가족부 장관을 향해 “극우 매체 종교 관련 매체 등이 이번 지적을 주도했다”며 “그런 극우 성향 매체에서 지적하면 정부 정책을 하루아침에 바꾸느냐”고 했다신 의원은 “여성단체에서도 사업을 지속하기를 요구하고 있다”며 “확신도 없이 문제제기가 나온다고 무작정 정책을 철회하는가 이러니 여가부를 없애자는 청원이 올라오는 것”이라고 했다같은 당 권인숙 의원도 “대부분 서구 국가에서도 정확한 성지식과 정보를 토대로 성교육을 하자는 공감대가 크다”며 “해당 도서를 회수한 것은 그러한 현장의 요구에 부응하지 못한 것”이라고 주장했다이에 대해 이정옥 장관은 “정부 정책이라기보다는 사회적기업 협력사업”이라며 “학부모단체와 만났는데 해당 학부모가 코로나 확진이 돼서 여가부 직원이 능동 감시가 되는 등의 상황이 벌어지면서 학부모들의 동의를 구하기 어렵겠다고 판단하고 회수했다”고 했다 이 장관은 해당 도서의 회수를 취소할 생각이 없느냐는 민주당 유정주 의원의 질문에는 “코로나19로 갈등이 고조되는 상황에서 이 부분을 또 다른 갈등으로 유발하는 것 같다”며 난색을 표했다선정민 sunnychosuncom  집 있어도 없어도 스트레스 혼돈의 부동산 유용원 군사전문기자의 밀리터리시크릿 밀톡  과학이 이렇게 재밌을수가 사이언스카페  ,https://news.naver.com/main/ranking/read.nhn?mid=etc&sid1=111&rankingType=popular_day&oid=023&aid=0003558436&date=20200901&type=1&rankingSectionId=100&rankingSeq=2
신문 보고 3년만에 알게 된 전 남편의 '바람',NYT 결혼란에 총각 행세한 전 남편 사연 실려그가 현재 신부를 만날 때 나의 남편이었다 폭로니키나 모레노의 전 남편 로버트가 인스타그램을 통해 자신과 새 아내 로렌의 결혼 사연을 소개한 뉴욕타임스 글을 공유한 게시글 로버트 팔머 인스타그램 갈무리 재판매 및 DB 금지서울연합뉴스 이영섭 기자  전 남편의 외도 사실을 신문을 통해 3년 만에 알게 된 미국 여성의 분통터지는 사연이 화제가 되고 있다1일 미국 CNN방송에 따르면 니키나 모레노30는 최근 일반 시민들의 결혼 사연을 소개하는 미국의 유력 일간지 뉴욕타임스NYT의 맹세 란에서 전 남편 로버트의 소식을 접했다신문에는 로버트가 2017년 1월부터 로렌이라는 여성을 만나 이달 초에 결혼했다고 소개돼 있었다 로버트는 그전까지 결혼 경험이 없다고도 적혀 있었다화가 난 모레노는 이후 다른 매체인 뉴욕포스트 인터뷰를 통해 사실 2017년 1월 당시 로버트는 자신의 남편이었다고 폭로했다그는 우리는 2017년 3월 말에 갈라섰고 이듬해 1월에 공식적으로 이혼했다며 우리가 이혼하게 된 이유를 명확히 이해할 수 없었다 NYT 글을 읽기 전까진이라고 밝혔다로버트가 자신과 결혼한 상태에서 로렌과 외도했으며 그로 인해 결국 이혼에 이르렀다는 것이다모레노는 로버트와 2015년에 결혼 신고를 하고 2017년 8월에 결혼식을 치를 준비를 하고 있었는데 그해 3월에 로버트가 갑자기 이혼하자고 말했다고 전했다그는 뭔가 다른 문제가 있다는 걸 알았다면서 그가 바람을 피우고 있다고 의심했지만 이에 관해 물어볼 때마다 그는 제대로 답하지 않았다고 말했다모레노는 같은 달 자신의 임신 사실을 알게 됐으나 5월에 유산했다고 밝혔다 그는 스트레스가 유산의 원인이라고 믿는다고 말했다모레노의 사연이 인터넷을 통해 확산하자 누리꾼들은 대체로 로버트를 비난하고 있다고 CNN은 전했다모레노의 뉴욕포스트 인터뷰가 공개된 후 NYT는 문제의 글에서 로버트가 이전에 결혼한 적이 없다는 대목을 삭제했다로버트는 뉴욕포스트에 니키타와 나는 서로 합의해 원만하게 이혼했다며 문제가 있다는 점을 몰랐고 이 모든 일이 놀랍다고 해명했다이혼게티이미지뱅크 제공youngleeynacokr코로나19 속보는 네이버 연합뉴스구독 클릭팩트체크 코로나19가 탈모 원인제보하기,https://news.naver.com/main/ranking/read.nhn?mid=etc&sid1=111&rankingType=popular_day&oid=001&aid=0011853092&date=20200901&type=1&rankingSectionId=104&rankingSeq=4
일본 '루사' vs 한국 '매미' 진로...예보 또 시험대,앵커기상청은 태풍 마이삭이 부산에 상륙해 영남지방을 관통할 것으로 전망했습니다하지만 일본은 진로를 대폭 수정해 전남 남해안에 상륙해 한반도를 관통할 것으로 내다봤습니다태풍 진로에 따라 피해 정도는 크게 달라집니다정혜윤 기자가 보도합니다기자태풍 마이삭은 태풍의 눈이 뚜렷하게 보일 정도로 발달했습니다중심 부근에는 초속 50m에 육박하는 폭풍을 동반한 매우 강한 태풍입니다오키나와 부근까지 올라온 태풍 마이삭기상청은 마이삭이 점차 북동쪽으로 방향을 틀어 경남 남해안을 향해 북상할 것으로 전망했습니다내일 저녁 제주도 동쪽 해상을 거쳐 모레 새벽에는 부산 부근 남해안에 상륙한다는 겁니다이후 경남 내륙을 관통해 동해로 이동할 것으로 보입니다우진규  기상청 예보분석관  태풍은 3일 새벽 약 3시쯤 되면 경남 해안 부근으로 상륙할 것으로 보입니다 가장 확률적으로 높은 구간은 거제와 부산 사이가 되지 않을까 예측되고 있지만기상청의 예상 진로는 2003년의 태풍 매미와 흡사합니다그런데 일본은 태풍 마이삭이 전남 남해안에 상륙해 우리나라를 관통할 것으로 예상했습니다2002년 태풍 루사와 비슷한 진로입니다기상청 예보대로 태풍이 움직이면 제주도와 영남 동해안 지역을 중심으로 피해가 집중됩니다그런데 일본 진로가 맞게 되면 서울을 비롯한 전국이 위험 지역이 됩니다기상청의 예측 능력이 또 한차례 시험대에 오르게 된 셈입니다하지만 어느 진로를 택하든 태풍 마이삭은 우리나라에 강풍과 폭우를 쏟아부어 큰 피해를 남긴 채 지나갈 가능성이 큽니다YTN 정혜윤입니다저작권자c YTN  YTN plus 무단전재 및 재배포 금지  이 시각 코로나19 확진자 현황을 확인하세요대한민국 대표 뉴스 채널 YTN 생방송보기네이버에서 YTN 뉴스 채널 구독하기 ,https://news.naver.com/main/ranking/read.nhn?mid=etc&sid1=111&rankingType=popular_day&oid=052&aid=0001485614&date=20200901&type=2&rankingSectionId=103&rankingSeq=4
‘미스터트롯? 아는형님?’… ‘집콕’ 다시 보기 “너무 비싸요~” [IT선빵!],월정액 JTBC 8800원 종편 중 가장 비싸채널ATV조선MBN오는 25일 7700원으로 인상콘텐츠 경쟁력이 핵심몸값 높아지는 콘텐츠 제공사들헤럴드경제박세정 기자 JTBC 8800원 채널AMBNTV조선 7700원코로나19의 재확산으로 집콕족의 VOD 콘텐츠 이용이 늘어나면서 종합편성 채널별 다시보기 가격이 주목된다 콘텐츠 경쟁력이 유료방송 성패의 핵심이 되면서 통신사 인터넷TVIPTV의 종편 월정액 상품 가격도 잇따라 오르고 있다 가격이 계속 오르면서 가격에 대한 고객들의 불만도 커지고 있다 월정액 상품은 월 일정 요금을 내면 무제한으로 콘텐츠를 볼 수 있는 상품이다종편 3사 가격 5500원→7700원 인상현재 종편 채널 중 IPTV 월정액 상품이 가장 비싼 곳은 JTBC다 JTBC는 2018년 3월 5500원에서 7700원으로 월정액 가격을 인상한 데 이어 지난 7월 다시 8800원까지 인상했다 이는 지상파 월정액 상품8800원과 같은 수준이다TV조선MBN채널A 등 종편 3사의 현 월정액 상품 가격은 5500원이다 3사의 월정액 상품은 이달 25일부터 7700원으로 인상된다 현재 월정액 이용고객은 기존 월 5500원으로 이용하되 해지 후 재가입하면 인상된 가격을 적용받게 된다통신업계 관계자는 이번 인상은 콘텐츠 공급사의 요청으로 이뤄지게 됐다고 설명했다VDO 사용시간 ↑콘텐츠사업자 협상력 커져유료방송시장에서 콘텐츠 경쟁력이 핵심이 되면서 플랫폼통신사보다는 콘텐츠 제공사들의 영향력은 갈수록 커지고 있다특히 코로나19로 콘텐츠 사용시간도 늘어난 상태라 통신사플랫폼 입장에서도 다양하고 질 높은 콘텐츠를 확보하는 것이 무엇보다 중요해졌다LG유플러스의 경우 올 상반기 영화 VOD 구매 건수가 전년 동기보다 158 늘었다 SK브로드밴드는 올 1분기 VDO 매출이 전년 동기 대비 14 늘었다 KT도 상반기 교육애니메이션 등 분야별 VDO 매출이 2045가량 늘었다업계에서는 상품 가격 책정 시 콘텐츠 제공사들의 협상력도 크게 확대된 것으로 보고 있다앞서 CJ ENM과 딜라이브의 수수료 논란이 대표적인 사례다 CJ ENM은 딜라이브에 프로그램 사용료 20 인상을 요구하면서 채널 송출을 중단하는 블랙아웃’까지 예고했다 최종 협상까지 난항을 겪으면서 정부까지 중재에 나선다통신업계 관계자는 과거에는 통신 플랫폼IPTV에 들어가는 것이 중요해 통신사들의 목소리가 상대적으로 컸지만 지금은 반대라며 채널들의 상품 가격 인상 요구가 있을 경우 통신사들은 그대로 수용하는 경우가 많다고 전했다sjparkheraldcorpcom엄마들이 꼽은 NO1 화상영어무료체험헤럴드경제 네이버 채널 구독 농수축산물 소비캠페인  Copyrights ⓒ 헤럴드경제  heraldbizcom 무단 전재 및 재배포 금지 ,https://news.naver.com/main/ranking/read.nhn?mid=etc&sid1=111&rankingType=popular_day&oid=016&aid=0001719555&date=20200901&type=1&rankingSectionId=105&rankingSeq=3
