Title,Contents,link
"""깎아달라"" 말도 안했다…30대가 집 사러 몰려간 곳[부릿지]",머니투데이 조한송 기자 부릿지GO3040 패닉바잉 리포트교통 편한 역세권 아파트 찾아 매수 나선 청년들 30대들의 패닉바잉공황 구매 현상이 계속된다 710 84대책에서 30대 실수요자를 위한 주택 공급정책을 발표했지만 기다리지 않고 매매에 나서는 이들이 늘고 있다 머니투데이 부동산 전문 유튜브채널 부릿지는 67월 아파트 매매가 급증한 강서구 방화동과 성동구를 찾았다 7월 한달 동안에만 30대가 서울에서 5300여채의 아파트를 매입했는데 이중 10인 553가구가 강서구 방화동에서 거래됐다 일대 중개인 등을 찾아 30대들이 찾는 아파트의 특징은 무엇이고 매매가 어떤 목적에 의해 이뤄지고 있는지 알아봤다 또 청약을 기다리라는 정부의 조언에도 불구하고 30대들이 영끌영혼까지 끌어모은다해서 주택을 매입하는 근본적인 이유가 뭔지도 짚어봤다 ━집 사는 30대 늘어난다10가 방화동에서 거래조한송 기자안녕하세요 부릿지입니다 오늘은 30403040대의 패닉바잉공황 구매 현상에 대해서 알아보도록하겠습니다 패닉바잉은 집값이 점차 오르자 계속 구매하지 않고 기다렸다가는 더 이상 집을 구매하지 못할것이란 불안심리에 의해서 매매하는 현상을 일컫습니다 한국감정원 통계에 따르면 30대는 지난 7월 서울에서 5300여 가구의 주택아파트를 매입했습니다 이는 전체 거래1만6002가구의 334 비중인데요 전 연령 중에서 30대의 매입 비중이 가장 높았습니다 30대의 매매거래 건수는 수치적으로만 봐도 지난해 1월 이후 가장 많은 건수인데요 정부가 710대책에서 생애최초 특별공급을 확대하는 등 30대들이 주택을 매입할 기회를 늘리겠다고 말했지만 시장에서는 먹히지 않았다는 것을 의미합니다 그래서 오늘 부릿지는 3040이 매입하는 주택은 어떤 것들이고 왜 매입하는지 이런 현상이 앞으로도 계속될지에 대해서 알아보도록 하겠습니다 조한송 기자제가 지금 나와있는 곳은 강서구 방화동입니다 강서구 내에서도 서북단에 위치해 김포공항 마곡지구가 가까운 곳입니다 지난 7월 강서구에서만 총 1290여 채의 아파트가 거래됐는데 요 이중 426553가구가 30대가 거래했을만큼 3040에게 인기가 좋은 지역입니다 KB부동산에 따르면 방화동의 33㎡1평당 매매가는 1894만원입니다 즉 30평형 기준으로 매매가는 5억6000만원선인데요 강서구 전체 평균 매매가23694만원 7억1082억원 보다 1억원 가량낮은 가격입니다 1990년대 초반 입주한 구축 아파트들이 대거 입지해 있습니다 지하철역은 5호선 방화역과 개화산역 9호선은 신방화역과 공항시장역을 이용할 수 있습니다 지금 제 뒤로 보이는 아파트가 강서구 방화동 소재 A’아파트입니다 전용면적 3349㎡로 이뤄진 소형 평수 단지인데요 통계를 보면 지난 68월 이 단지에서만 총 89건의 거래가 이뤄지며 방화동에서 가장 많은 거래건수를 보였습니다 매매가도 78개월 사이에 8000만원 이상이 뛰었는데요 이 단지 말고도 BC 단지의 거래량이 많았습니다 그럼 이제부터는 중개소들을 돌아보면서 어떤 분들이 이 아파트를 매입했고 어떤 용도로 거래가 이뤄졌는지를 알아보도록 하겠습니다  강서구 방화동 A 공인중개소 관계자Q 어떤 사람이 주로 매물을 내놓나요즘은 투자했다가 세금 때문에 내놓는 분들 도 있고 평수넓혀서 이사가려는 분들도 있다 매물이 많지는 않다 다주택자라서 다른 주택 구입하는데 집이 있으면 세금취득세 8 내야해서 내놓는 경우가 있었다 강서구 방화동 B 공인중개소 관계자Q 주로 누가 어떤 용도로 매물을 샀나30대만 사는게 아니고 20대도 많이 산다 14평 같은 경우는 취득세 8 내고도 산 경우가 있다 그것도 가격도 깎지 않고 현재 시세가로 맞춰서 깎으려고하면 안파니까 깎지않고 취득세까지 내고 산거다 취득세 때문에 투자 목적으로 사려는 다주택자는 들은 발이 끊긴 상태다 서울 대단지 아파트를 이정도 금액으로는 더이상 구하기 쉽지않다는 조바심에들 산다 강서구 방화동 C 공인중개소 관계자Q 주로 누가 어떤 용도로 매물을 샀나최근까지도 젊은 사람들이 주로 많이 샀다 신혼부부들이 많이 찾는다 요즘은 다 실거주 할 사람들이 찾는다고 보면 된다 집값이 자꾸 오르니까 집을 꼭 사야 하는 젊은 사람들은 더 기다렸다가는 이 집도 못사겠다 싶어서 산다 더 기다렸다가는 집값이 계속 오르는 중이니 못 살것 같다고 보는거다 소형 평수라 젊은 사람들이 살 수가있는 금액이기도 하다 4050대가 거주하려고 사기에는 좁은 평수다 ━강남권 출퇴근 수요 성동구로 몰려━조한송 기자성동구에서도 30대 매입 비중이 높았습니다 특히 행당동과 하왕십리동에서 거래가 많았는데요 서울지하철 2호선이나 5호선 인근의 역세권 단지들로 매매가는 9억원 초반대였습니다성동구 행당동 A 공인중개소 관계자 지금 나오는 물건들 보면 다주택자 물건이 좀 있다 반면 법인은 많지 않다 서울에서 법인 매물은 그렇게까지 많지는 않다고 본다 다주택자들 세금 규제가 심해서 요새 투자하는 분들은 주춤하다 성동구 행당동 B 공인중개소 관계자 계약한 손님들 거의 젊은층이다 실거주로 아니면 세 껴놓고 내년 초에 입주하기 위해서 샀다 본인 전세 여윳돈에 세 만기일 맞춰서 구입했다김학렬 스마트튜브 부동산조사연구소장성동구는 강남 출퇴근 지역이다 강남권에서 주택을 구입하기에는 비싸고 전세도 없다보니 성동구까지 가는거라고 보면 된다 강서구는 마곡지구 호재도 있긴 하지만 인근 지역인 목동에 매물이 없다보니 양천구 수요가 몰려다고 본다 인근 지역에서 세입자로 살다가 전세를 못구하니까 성동구나 강서구로 간거다  실수요다수도권에서 127만가구를 공급하겠다고 대책을 발표했지만 구체적인 내용이 하나도 없다 가상의 숫자다 실수요자 입장에서 23년까지는 기다릴 수 있겠지만 그 안에 입주할 수 있는 게 없다  3기신도시도 서울 수요가 아니고 수도권 수요를 충족할 뿐이다 재개발 재건축을 활성화하거나 공급 대책에서 발표한 서울시 내 물량을 바로 분양하는 등 적극적인 공급 시그널이 필요하다 조한송 기자공인중개소와 전문가 멘트를 종합해보면 30대들이 실거주 목적으로 중저가의 20평대 매물들을 주로 사고 있는 것으로 나타났습니다 그나마 덜 오른 매물중에서 호재가 있는 곳을 찾다보니 방화동으로 몰린 것으로 보입니다  20평 안팎의 중저가 아파트를 찾으면서 방화동으로 몰린 것으로 보입니다 다주택자들이 취득세 등을 고려해 내놓은 매물을 30대들이 사고 있는 현상도 나타났습니다 전문가들은 84공급대책 조차 30대들에게 확실한 공급 시그널을 주지 못한 것을 원인으로 꼽고 있는데요 이들에게 마냥 기다리라고만 할 것이 아니라 좀 더 확실한 공급 대책을 마련해야 한다는 진단이 있었습니다 오늘 부릿지에서는 패닉바잉에 나선 3040이 어떤 주택들을 왜 매입하고 있고 어떤 거래패턴이 나타나고 있는지 분석해봤는데요 다음시간에도 더 현장감 있는 내용으로 찾아뵙도록 하겠습니다 출연 조한송 기자촬영 방진주 인턴 김윤희 인턴편집 방진주 인턴디자인 신선용 디자이너조한송 기자 1flowermtcokr줄리아 투자노트조 변호사의 가정상담소 머니투데이 구독하기 저작권자 ⓒ 돈이 보이는 리얼타임 뉴스 머니투데이 무단전재 및 재배포 금지,https://news.naver.com/main/ranking/read.nhn?mid=etc&sid1=111&rankingType=popular_day&oid=008&aid=0004466111&date=20200904&type=1&rankingSectionId=101&rankingSeq=2
"'하이선', 대형 태풍으로 커진다…7일 통영 부근 상륙",앵커10호 태풍 하이선이 올라오고 있는데요 다음 주 월요일 오는 7일 낮에 경남 통영 부근에 상륙하고 이후 한반도를 또 관통할 걸로 예상됩니다 태풍의 영향으로 모레6일 일요일부터 비가 예보돼 있습니다안영인 기자입니다기자동아시아 지역 위성 영상입니다일본 오키나와 남동쪽 해상에서 눈까지 뚜렷한 강한 소용돌이 구름이 북상하고 있습니다10호 태풍 하이선입니다이미 강한 태풍으로 발달한 하이선은 뜨거운 바다를 지나면서 더욱 강해져 오늘 오후에는 매우 강한 태풍으로 발달하겠고 내일 오후쯤에는 대형 태풍으로 몸집까지 키울 전망입니다특히 내일부터는 진행 방향을 점차 북서쪽으로 틀어서 남해상으로 곧장 북상해 다음 주 월요일 낮 12시쯤에는 경남 통영 부근에 상륙하고 계속해서 영남과 충북 강원 지방을 관통할 것으로 기상청은 전망했습니다한반도 동쪽의 북태평양 고기압이 마치 커다란 벽처럼 버티고 서 있어 태풍이 일본 쪽으로 빠져나가지 못하고 계속해서 한반도로 올라오는 겁니다특히 태풍이 한반도를 관통하는 동안에도 태풍 마이삭과 비슷한 강한 세력을 유지할 것으로 기상청은 예상했습니다기상청은 또 태풍의 강풍 반경이 400km 정도로 커서 진로가 조금 바뀌더라도 한반도 전 지역이 태풍의 영향을 받을 것으로 전망했습니다안영인 기자younginsbscokr 제9호 태풍 마이삭 피해 속출​ 뉴스속보 보기 코로나19 재확산 비상 더 깊은 인물 이야기 그 사람 ⓒ SBS  SBS Digital News Lab  무단복제 및 재배포 금지,https://news.naver.com/main/ranking/read.nhn?mid=etc&sid1=111&rankingType=popular_day&oid=055&aid=0000839390&date=20200904&type=2&rankingSectionId=103&rankingSeq=4
"쇼인줄 알았는데···메르켈 ""푸틴 답해라"" 나발니 테러 분노 왜",獨 나발니 체내서 노비촉 중독 증거 나와 메르켈 두 차례 기자회견 이례적러시아 책임론 꺼내 크림반도벨라루스러 영향력 견제 속내도메르켈 러시아 천연가스관 사업 협력과 나발니 사건은 별개  “러시아 정부만이 답할 수 있는 심각한 문제”  독일이 반反푸틴 인사 알렉세이 나발니의 독극물 중독 사건을 두고 연일 러시아를 압박하고 있다 나발니 체내에서 독극물이 검출됐다는 발표까지 나오자 그 수위는 더 세졌다  독일의 선장에 앙겔라 메르켈 독일 총리가 있다 평소 신중하고 온화한 모습을 보이는 메르켈이지만 이번 만큼은 단호하고 강한 태도로 일관하고 있다 메르켈 총리가 러시아의 독극물 공격 의혹 사건과 관련해 두 차례나 직접 기자회견을 연 것도 이례적이다앙겔라 메르켈 독일 총리는 2일현지시간 기자회견을 열고 의식불명 상태에 빠진 알렉시아 나발니는 살인미수의 희생자라며 러시아 정부만이 답할 수 있는 심각한 문제라고 말했다 독일 총리가 직접 나서서 러시아 독극물 테러 의혹에 발언한 건 이례적이다 AP연합뉴스 ━러시아가 나발니를 독일로 보낸 까닭은사건 초반 메르켈의 러시아 압박은 보여주기 식’이라는 분석이 우세했다 독일에 러시아는 정치적으로는 경계 대상이지만 경제적으로는 협력 관계라는 이유에서다  미국의 반발 속에 독일과 러시아가 함께 진행 중인 해저 천연가스관 연결사업 노르트 스트림 2’가 주요 원인으로 지목됐다 양국이 일정 부분 협력해야 하는 만큼 이번 사건을 대결 구도로 비화시키진 않을 것이라는 관측이었다  독일 일간 디벨트는 나발니 사건을 둘러싼 독일과 러시아의 반응을 “프로그램된 갈등”이라고 평가하기도 했다  러시아 시베리아에서 모스크바로 향하던 비행기에서 쓰러진 나발니가 8월 21일현지시간 러시아 병원에서 독일 병원으로 이송되고 있다 메르켈 총리는 나발니를 독일 병원으로 이송하자고 제안하고 핀란드 대통령을 중재자로 내세워 푸틴 대통령의 협력을 이끈 것으로 전해진다 EPA연합뉴스 ━메르켈 정말 뿔났다  그러나 메르켈의 분위기는 줄곧 심상찮다 메르켈은 지난달 20일 나발니가 의식불명에 빠졌다는 소식이 나온 직후부터 발 빠르게 움직였다  나발니 사건을 접한 지 2시간 만에 에마뉘엘 마크롱 프랑스 대통령과 정상회담을 열고 사건 경위 조사 촉구를 이끌더니 이틀 만에 나발니를 독일로 이송해 치료했다  지난달 25일에는 나발니의 독극물 중독 의심 결과가 나오자 이례적으로 독일 외무부 장관과 합동 기자회견도 열고 “철저하고 투명한 조사를 긴급히 요청한다”고 말했다 2일에는 독일 정부가 “나발니가 신경작용제인 노비촉에 중독된 명백한 증거가 있다”고 발표하자 노골적으로 러시아를 압박했다  그는 기자회견을 열고 “나발니는 살인미수의 희생자”라면서 “그의 침묵을 원한 누군가가 독극물을 사용했다”고 말했다 이어 “러시아 정부만이 답할 수 있고 반드시 답해야 할 매우 심각한 질문이 있다”고 덧붙였다 러시아 배후설을 넘어 러시아 책임론을 꺼내 든 것이다  블룸버그 통신은 메르켈이 평소 기자회견에서 차분하고 신중한 단어를 선택하지만 이번 사태에서는 강한 어조를 보인다고 평가했다 한 독일 정부 소식통은 메르켈이 기자회견을 통해 “이번 사건을 매우 심각하게 보고 있다”는 메시지를 크렘린 궁에 전한 것이라고 말했다  독일은 2일 나발니가 신경화학물질인 노비촉에 중독됐다는 증거가 발견됐다고 밝혔다 AP연합뉴스  ━“메르켈 러시아 압박 속내 따로 있다”메르켈은 왜 이토록 러시아의 독극물 공격 의혹에 분노하는 걸까 서구 언론은 그동안 독일을 상대로 한 러시아 측의 공작 의혹에 칼을 꺼내든 것이라고 분석했다  지난해 1월 발생한 독일 연방하원 의회 해킹 사건과 지난해 8월 베를린 시내에서 발생한 조지아인 살해 사건이 대표적이다 두 사건 모두 용의자들이 러시아 정보기관 정찰총국GRU 요원으로 밝혀졌지만 러시아는 혐의를 부인하며 모르쇠로 일관했다  독일은 러시아 외교관을 추방하고 러시아 대사를 초치하는 등 강력하게 대응했지만 양국 관계는 이미 틀어진 상황이다 메르켈은 해킹 사건과 관련해 “나는 매일 러시아와 신뢰를 쌓기 위해 노력하고 있는데 솔직히 이 사건이 나를 아프게 했다”며 불만을 표출하기도 했다 다만 당시에는 이 문제를 외교 갈등으로까지 끌고 가지는 않았다 ━크림반도 병합벨라루스 입김러시아 견제 위해  이제는 러시아의 팽창 정책을 견제해야 할 때라는 판단에 따른 것이라는 분석도 나온다 러시아가 크림반도 강제 병합과 벨라루스 정국 개입을 발판으로 유럽 내 영향력을 넓히려 하자 불안감을 느꼈다는 것이다이미 독일은 러시아의 세력 확장에 민감한 반응을 보여왔다 지난 6월 러시아의 크림반도 강제 병합을 이유로 내려진 유럽연합의 경제 제재를 1년 연장하는 것에 독일이 앞장섰다  지난해 12월 러시아 소치에서 벨라루스 루카셴코 대통령과 만난 블라드미르 푸틴 대통령가운데 EPA연합뉴스한 달 뒤 주요 7개국G7 정상회의에 러시아를 가입시키자는 도널드 트럼프 미국 대통령의 구상안에도 누구보다 먼저 나서서 반대했다 지난해 1월 발생한 해킹 사건과 관련해서도 EU 차원에서 러시아를 제재할 방안을 준비 중이다  여기에 최근 불거진 벨라루스 시위 사태로 긴장은 더 고조됐다 민중시위로 혼란스러운 벨라루스에 러시아가 군사적 지원을 약속하자 독일이 EU와 함께 반기를 든 것이다  푸틴 대통령은 “벨라루스 내정에 어떤 외부 간섭도 용납할 수 없다”면서 서방 국가는 벨라루스 사태에 개입하지 말라고 경고했지만 메르켈은 아랑곳하지 않았다 오히려 메르켈은 푸틴 대통령과의 통화에서 “벨라루스 정부는 시위대에 대한 폭력 사용을 중단하고 루카셴코 대통령은 야권과 대화해야 한다”고 촉구했다  독일은 개인의 자유와 민주주의를 중시하는 인식이 강한 만큼 러시아의 독극물 공격 의혹을 인권 문제에 대한 도전으로 받아들인 것이라는 해석도 나온다  ━메르켈 강경 대응 예고  이번 사건은 앞으로 독일을 중심으로 한 서방 국가와 러시아의 외교 갈등으로 번질 전망이다  독일은 우선 이번 조사 결과를 유럽연합EU과 나토NATO북대서양조약기구 유엔 산하 화학무기 금지기구OPCW에 전달하겠다는 방침이다 국제기구에 공식적으로 문제를 제기하고 국제법으로 사건을 다루겠다는 것이다  블룸버그 통신에 따르면 독일이 이번 조사 결과를 EU 등에 전달하기로 한 데는 메르켈 총리의 강경하고 원칙적인 입장이 영향을 미쳤다  메르켈 총리는 나발니 독극물 중독 의혹 사건에 러시아 책임론을 거론하며 국제사회에 공식으로 문제를 제기했다 앞으로 독일을 중심으로 한 서방국가의 대러시아 압박은 더 거세질 전망이다 AP연합뉴스당초 독일 의회는 러시아 책임론을 제기하기에는 시기상조라며 우려를 표했다 오히려 이번 사건을 노르트 스트림2 협상 카드로 내걸자고 제안했다  그러나 메르켈은 “의회의 제안은 적절하지 않다 나발니 사건과 노르트 스트림2는 별개 문제”라며 선을 그었다고 한다 앞으로 이번 사건에 대한 러시아의 책임을 추궁하겠다는 의지로 읽힌다  여기에 미국과 영국 프랑스 EU까지 나서고 있다 서방국은 과거 반反푸틴 인사들이 독극물 공격을 받았던 사건을 언급하며 “러시아 정부는 나발니에게 일어난 일을 반드시 설명해야 할 것”이라고 규탄하고 있다  한편 러시아는 이날 독일 발표에도 “나발니가 독일로 이송되기 전 러시아 병원에서 한 검진에서 독성 물질은 검출되지 않았다”며 기존 입장을 되풀이했다  이민정 기자 leeminjung2joongangcokr 넌 뉴스를 찾아봐 난 뉴스가 찾아와 그래서 팩트가 뭐야 궁금하면 팩플 세상 쉬운 내 돈 관리 그게머니ⓒ중앙일보httpsjoongangcokr 무단 전재 및 재배포 금지,https://news.naver.com/main/ranking/read.nhn?mid=etc&sid1=111&rankingType=popular_day&oid=025&aid=0003032191&date=20200904&type=1&rankingSectionId=104&rankingSeq=4
"[속보] 민주당, 대한의협과 5개 합의문 최종합의···오전 8시30분 서명식",의대 정원 확대공공의대 신설 등코로나 안정화 이후 재논의키로집단 휴진 사태 보름만에 종료더불어민주당 한정애 신임 정책위의장이 1일 오전 국회에서 열린 원내대책회의에서 발언하고 있다 연합뉴스서울경제 정부 여당과 의료계가 밤샘 협상 끝에 4일 공공의료 확충 정책과 관련한 협상을 매듭지은 것으로 확인됐다민주당 핵심 관계자는 더불어민주당과 대한의사협회가 이날 오전 8시 30분 여의도 민주당사에서 5개 조항에 대한 최종 합의문 서명식을 진행할 예정이라고 전했다 서명식에는 한정애 정책위의장과 최대집 의협 회장이 참석할 것으로 알려졌다 보건복지부 등 정부 측도 참여해 세부 문구를 조율하고 있는 것으로 전해졌다 이에 따라 지난달 21일부터 이어진 의료계 집단휴진 사태가 약 보름 만에 종료될 것으로 전망된다 특히 의과대학 정원 확대 공공의대 설립 등 정부 정책과 관련 “국회에 제출된 법안을 모든 가능성을 열어놓고 원점에서 재논의한다”는 문구가 최종 합의문에 담긴 것으로 전해져 정부의 관련 정책 추진은 일단 중단될 것으로 관측된다김경림기자 forest03sedailycom서울경제 바로가기 산업이슈 알기쉽게 양철민의 인더스트리 네이버 채널에서 서울경제 구독해주세요저작권자 ⓒ 서울경제 무단 전재 및 재배포 금지,https://news.naver.com/main/ranking/read.nhn?mid=etc&sid1=111&rankingType=popular_day&oid=011&aid=0003792926&date=20200904&type=1&rankingSectionId=100&rankingSeq=1
벨기에 분수대에서 181년 전 사망한 시장 심장 발견돼,사진 출처  베르비에시벨기에 동부 베르비에에 있는 한 분수에서 181년 전 사망한 이의 심장이 보관함에 담긴 채 발견됐다 심장의 주인은 베르비에시 초대 시장인 피에르 다비드였다지난 2일현지 시각 영국 BBC에 따르면 베르비에시는 도시 분수대 보수 작업 중 피에르 다비드의 심장이 담긴 보관함을 발견했다이 보관함 겉면에는 1883년 6월 25일 피에르 다비드의 심장이 엄숙하게 안치되었다라고 적혀있었다피에르 다비드 시장은 181년 전인 지난 1839년 68세 나이로 세상을 떠났다 이후 시 당국은 피에르 다비드 시장을 기리기 위한 기념물에 안치할 목적으로 유족의 동의를 받아 그의 심장을 보관해왔다이후 1883년 그의 이름을 딴 분수를 만들었고 피에르 다비드 시장의 심장을 이곳에 안치한 것으로 파악된다사진 출처  베르비에시심장은 알코올로 가득한 병에 봉인되어 보관함에 담겨있던 것으로 알려졌다 시 관계자는 도시의 전설이 현실이 됐다라며 분수대 보수 작업 중 피에르 다비드 흉상 근처에 있던 돌을 제거했더니 보관함이 놓여있었다라고 전했다현재 보관함은 시 미술관에 특별 전시된 상태라고 전해진다피에르 다비드 시장은 18001808년에 처음으로 베르비에 시장으로 재직했다 이후 1830년 벨기에가 혁명을 통해 네덜란드로부터 독립했고 널리 존경받던 피에르 다비드가 다시 시장으로 부임해 도시 재건 임무를 맡았다YTN PLUS 문지영 기자moonytnpluscokr저작권자c YTN  YTN plus 무단전재 및 재배포 금지  이 시각 코로나19 확진자 현황을 확인하세요대한민국 대표 뉴스 채널 YTN 생방송보기네이버에서 YTN 뉴스 채널 구독하기 ,https://news.naver.com/main/ranking/read.nhn?mid=etc&sid1=111&rankingType=popular_day&oid=052&aid=0001486775&date=20200904&type=1&rankingSectionId=104&rankingSeq=2
