Title,Contents,link
"“미안하다, 내 갈길 떠난다” ‘여행에 미치다’ 조준기, 응급처치 후 병원 이송[전문]",1일 오전 서울 용산서 위중 상태로 발견 인스타에 극단 선택 암시글 올려“불필요한 피해 발생 않길” 네티즌 “나쁜 마음 먹지 말라” “경찰에 신고해야”음란 동영상 게시물을 인스타그램에 올렸다는 논란에 휩싸인 여행 정보 소개 채널 여행에 미치다’ 조준기 대표가 1일 자신의 소셜미디어에 극단적인 선택을 암시하는 글을 올린 뒤 위중한 상태로 발견됐다1일 경찰에 따르면 조 대표는 이날 오전 11시쯤 서울 용산구 모처에서 의식이 불명확한 상태로 발견됐다 그는 심폐소생술CPR 등 응급처치를 받으며 인근 병원으로 옮겨졌다 경찰 관계자는 “조준기의 지인이 신고를 해 소방 구조대와 이태원 파출소에서 출동을 했다”며 “CPR 하면서 병원으로 이송해 호흡과 맥박이 돌아왔다”고 했다조 대표는 이날 오전 10시 50분쯤 인스타그램에 “이제 더 이상 그 누구에게도 짐이 되지 않고 내 갈 길로 떠나려고 한다 끝까지 이기적일거니 차라리 미워하고 원망해주길”이라며 “정말 모두에게 너무 미안하다 나 때문에 이유 없이 고통 받고 욕 먹는 크루들 친구들 그리고 제일 사랑하는 가족들까지”라고 했다여행에 미치다 대표 조준기조 대표는 “정말 지금까지 여한 없이 불행했고 행복했으며 여러분들과 함께 하는 모든 날이 더할나위 없었던 내 인생 전부이자 진심이었다”며 “마지막으로 조준기를 가족으로 대표로 친구로 사랑하는 사람으로 대해줬던 모든 사람들에게 이리 부족한 나를 항상 보듬아주고 응원해줘서 고마웠다고 이렇게 얼굴도 못 보고 죄만 짓고 떠나 너무 가슴 아프다고”라고 적었다 그러면서 “정말 너무 미안해 모두 언젠가 길 위에서 다시 만나자”고 했다조 대표는 이런 내용의 글과 함께 부의금을 자신의 계좌로 보내달라고 썼다 그는 “추신  코로나 시국이니 장례식은 가족끼리만 해주고 지인들 부조는 남은 우리 가족들크루들 다시 잘 살아갈 수 있도록 05520104 ○○은행 조준기여행에미치다로 보내놔주면 좋겠다”라고 썼다그러면서 “사건은 사건 그 자체만으로의 과실을 따져주길 불필요한 인과들로 불필요한 피해가 발생하지 않기를 바란다”며 ”크루들이 새로이 시작해 나갈 때 부디 많은 도움과 응원도 부탁드린다 잘못은 내가 혼자 한건데 나머지 19명까지 같이 싸잡아 욕 할 필요 없잖아요 얼마나 능력 있고 성실하며 나보단 그 얼마나 떳떳하게 살아가는 사람들인데 괜히 나 때문에 이들 또한 피해 본 사람들인 걸요”라고 했다이에 네티즌들은 “살면서 실수할 수도 있는데 나쁜 마음 먹지 말라” “경찰에 신고해야 하는 것 아니냐”는 등 댓글을 달았다조 대표 “내가 영상 올린 당사자”→ 2차 사과문선 “업로드를 진행한 담당자”앞서 최근 120만 인스타그램 팔로워를 보유한 여행에 미치다의 공식 소셜미디어에 영상 음란물을 올라와 논란을 빚은 바 있다 지난달 29일 이 회사 인스타그램 공식계정에는 강원도 평창 양떼 목장’을 소개하는 게시물이 여러 사진동영상과 함께 올라왔다 이 가운데 문제가 된 음란물로 추정되는 동영상이 포함됐다 네티즌들은 “음란물 아니냐” “불법 촬영된 영상으로 보인다”라고 했다해당 게시물은 곧바로 삭제됐고 1차 사과문이 올라왔다 여행에 미치다 측은 “일말의 변명 없이 관리자로서 신중히 신경쓰지 못해 게시물을 보신 많은 분뿐만 아니라 게시물을 제공해주신 분께도 피해를 끼치게 됐다”며 “불쾌한 영상과 미숙한 운영 및 조치로 실망하셨을 분들에게 다시 한번 머리 숙여 사과드린다”고 했다조 대표는 이 사과문에 직접 댓글을 달았다 그는 “심려를 끼쳐 죄송하다 금일 양떼 목장 게시물을 직접 업로드한 당사자다”라며 “해당 영상의 경우 트위터에서 다운로드한 영상이다 직접 촬영한 형태가 아니다”라고 했다 이어 “영상에 포함된 인물 모두 동성同性입니다 영상을 불법 다운로드한 부분에 있어서는 적절한 처벌을 받도록 하겠다”라며 “해당 사안으로 피해를 끼치게 된 회사에 큰 책임을 느끼는 바 금일부로 대표직을 내려놓도록 하겠다”라고 했다그러나 30일 사과문이 재차 올라왔고 1차 사과문은 비공개 처리됐다 여행에 미치다는 2차 사과문에선 “콘텐츠 업로드 중 부주의로 인해 이번과 같은 상황이 발생했다 관련 사항은 보다 정확한 판단을 위해 사법기관에 의뢰할 예정”이라면서 “어떠한 변명의 여지 없이 해당 영상을 직접 촬영하지 않았더라도 단순 소지 자체만으로도 문제이며 법적으로 처벌을 논해야 하는 상황이다 이에 내부적으로 이번 문제의 심각성을 인지하고 업로드를 진행한 담당자와 함께 사법기관에 정식으로 사건 접수를 진행하겠다”라고 했다문제의 영상을 대표 조준기씨가 직접 업로드했다’는 1차 사과문과 댓글과는 달리 2차 사과문에서는 업로드를 진행한 담당자’로 표현이 바뀌었다 또 대표직에서 사퇴하겠다’라고 밝힌 내용은 아예 사라졌다 여행에 미치다 측은 두 번째 올린 사과문에서 “본 팀은 해당 문제의 심각성을 인정하며 사법기관에 의뢰한 진행 상황과 결과에 대해 책임있게 공유드리겠다”며 “기업 법정 의무교육 외에 추가적으로 전직원 대상 성윤리 관련 교육을 진행하겠다”라고 했다소셜미디어와 온라인 커뮤니티에선 여행에 미치다에 올라온 영상이 불법 촬영 동영상으로 의심된다며 관계 당국에 신고한 내역을 공개하는 네티즌들의 인증이 이어졌다 서울 강남경찰서는 이번 사건과 관련해 “여행에 미치다’ 인스타그램에 성관계 영상이 올라온 사건을 언론 보도를 통해 인지한 뒤 내사에 착수했다”고 밝혔다여행에 미치다는 2014년 조 대표가 여행 정보를 페이스북 페이지에 게재하는 것으로 시작해 현재 인스타그램과 유튜브 등 각종 플랫폼에서 도합 수백만 구독자를 거느린 여행 전문 회사다 페이스북 페이지는 202만명이 구독 중이며 인스타그램은 120만명 유튜브는 40만명의 구독자가 있다다음은 조준기 대표가 인스타그램에 올린 글 전문정말 모두에게 너무 미안하다ㅡㅡ 나 때문에 이유 없이 고통 받고 욕 먹는 크루들 친구들 그리고 제일 사랑하는 가족들까지이제 더 이상 그 누구에게도 짐이 되지 않고 내 갈 길로 떠나려고 함ㅡㅡ 끝까지 이기적일거니 차라리 미워하고 원망해주길정말 지금까지 여한 없이 불행했고 행복했으며 여러분들과 함께 하는 모든 날이 더할나위 없었던 내 인생 전부이자 진심이었다마지막으로 조준기를 가족으로 대표로 친구로 사랑하는 사람으로 대해줬던 모든 사람들에게 이리 부족한 나를 항상 보듬아주고 응원해줘서 고마웠다고 이렇게 얼굴도 못 보고 죄만 짓고 떠나 너무 가슴 아프다고정말 너무 미안해 모두 언젠가 길 위에서 다시 만나자추신  코로나 시국이니 장례식은 가족끼리만 해주고 지인들 부조는 남은 우리 가족들크루들 다시 잘 살아갈 수 있도록 05520104XXXXXX ○○은행 조준기여행에미치다로 보내놔주면 좋겠음ㅡㅡ사건은 사건 그 자체만으로의 과실을 따져주길 불필요한 인과들로 불필요한 피해가 발생하지 않기를 바랍니다크루들이 새로이 시작해 나갈 때 부디 많은 도움과 응원도 부탁드립니다 잘못은 내가 혼자 한건데 나머지 19명 까지 같이 싸잡아 욕 할 필요 없잖아요 얼마나 능력 있고 성실하며 나보단 그얼마나 떳떳하게 살아가는 사람들인데 괜히 나 때문에 이들 또한 피해 본 사람들인걸요김명진 cccvchosuncom  집 있어도 없어도 스트레스 혼돈의 부동산 유용원 군사전문기자의 밀리터리시크릿 밀톡  과학이 이렇게 재밌을수가 사이언스카페  ,https://news.naver.com/main/ranking/read.nhn?mid=etc&sid1=111&rankingType=popular_day&oid=023&aid=0003558377&date=20200901&type=1&rankingSectionId=105&rankingSeq=1
"[단독] 이통3사, 따로 DB 만들어 ‘위치 정보’ 몰래 모았다",기지국 접속기록 삭제 않고 위치 정보 3개월까지 보관경찰질병관리본부 등 제공공익 목적 외에 빅데이터 포석가입자 사전 고지동의도 없어그래픽김승미이동통신 가입자들의 이동경로를 나타내는 휴대전화 위치확인 정보기지국 접속기록가 사전 고지동의 없이 축적되고 있는 것으로 밝혀져 논란이 일고 있는한겨레 8월31일치 19면 가운데 이동통신사들이 빅데이터 사업을 위해 별도의 데이터베이스를 만들어 기지국 접속기록 삭제 없이 해당 정보를 축적하고 경찰과 질병관리본부 등에 제공해온 것으로 드러났다 이통사 내부에서도 “빅데이터 사업을 위해 가입자의 민감한 개인정보에 해당하는 기지국 접속기록을 축적하는 행위인만큼 사전에 따로 고지와 동의 절차를 거쳐야 했다”는 뒤늦은 반성이 나온다이동통신 네트워크는 통신 즉시 연결을 위해 각 가입자의 휴대전화가 현재 어느 기지국에 물릴 수 있는 상태인지를 주기적으로 확인한다 휴대전화가 자신의 정보를 실은 전파를 정기적으로 발사하는데 가까운 기지국이 받아 네트워크로 보낸 정보가 기지국 접속기록이다 이를 활용하면 가입자의 시간대별 이동경로를 파악하고 특정 지역에 있었던 가입자들을 시간대별로 뽑아낼 수 있어 매우 민감한 개인정보로 간주된다이름을 밝히지 말 것을 요청한 주요 이통사 고위 임원은 1일 한겨레에 “실제 이뤄진 통신이 어느 기지국을 경유했는지 등에 대한 정보는 과금 정보 데이터베이스에 보관하고 기지국 접속기록은 네트워크 쪽에 따로 구축된 데이터베이스에 로우 데이터가입자 확인이 안되는 형태로 축적해 활용하고 있다”고 밝혔다 그는 “2000년대 중반까지만 해도 기지국 접속기록은 현재 데이터만 두고 삭제하거나 가끔 통신망 업그레이드 뒤에 하루 이틀 축적해 네트워크 품질 상태를 파악하는 용도로만 활용했는데 2000년대 후반 이통사들이 빅데이터 사업에 눈을 뜨면서 축적 기간을 늘려 지금은 3개월까지 보관하고 있다”고 덧붙였다  이미지를 누르면 크게 볼 수 있습니다이 임원은 이어 “요즘은 경찰의 기지국 수사’와 질병관리본부의 방역 방해 행위자 색출’ 협조 차원에서 특정 시간지역 기지국 접속자 명단을 제공할 때도 네트워크 쪽 데이터베이스에서 뽑아낸다”고 말했다 그는 “2015년 메르스 사태 때 질병관리본부 쪽의 특정 기지국 접속자 명단 제출 재촉이 심했다 처음에는 요구받은 명단 제출 시기가 사업자별로 차이가 있었는데 늦은 사업자 쪽은 추궁을 당했다 빨린 보낸 사업자 쪽에 비결을 알아보니 과금 정보 데이터베이스가 아닌 기지국 접속기록을 따로 저장한 데이터베이스에서 뽑는다고 했다 실제로 해보니 과금 정보 데이터베이스에서 뽑을 때보다 서버 부하도 적고 시간도 훨씬 덜 걸렸다 이후 3사 모두 그 방식으로 하고 있는 것으로 알고 있다”고 덧붙였다 이 임원은 “특정 기지국 접속자 명단을 질병관리본부 등에 제공한 것은 공익 목적이고 통신비밀보호법과 감염병 예방법에 정해진 절차를 따른 것이라 크게 문제될 것은 없다고 본다 다만 빅데이터 사업 목적으로 기지국 접속기록 축적을 시작할 때 별도 고지와 동의 절차를 제대로 이행하지 않은 것은 지금이라도 바로잡을 필요가 있는 것으로 판단된다”고 말했다이통사들은 공식 확인을 거부했다 한 이통사 홍보실은 “확인해줄 수 없다는 게 공식 입장”이라고 밝혔다 다른 이통사 홍보실 역시 “확인되지 않는다”고만 말했다 또다른 이통사 홍보실은 “네트워크 쪽 데이터베이스에 축적된 기지국 접속기록은 그 자체로는 가입자 확인이 안되는 로우 데이터 형태라서 따로 고지와 동의 절차를 거치지 않았을 수 있다”고 밝혔다 하지만 공익 목적이지만 기지국 접속기록을 바탕으로 경찰과 질병관리본부에 가입자 명단이 제공된 선례가 있어 설득력이 떨어진다개인정보 보호 활동을 벌이고 있는 시민단체들은 “이통사들이 빅데이터 사업을 위해 가입자들의 이동경로를 나타내는 민감한 개인정보기지국 접속기록을 몰래 축적했다는 거 아니냐 이통사 최고경영자들이 과학기술정보통신부 장관과 국회의원들을 만날 때마다 요청하는 등 데이터 3법’ 개정에 왜 그렇게 목을 맸는지를 단적으로 보여준다”고 주장했다 오병일 진보네트워크센터 대표는 “이동통신 서비스 제공에 필수적인 개인정보를 최소한으로 수집해야 한다는 원칙을 위배했고 명시적인 사전 고지와 동의가 없었던 부분은 불법 소지도 있다”고 지적했다김재섭 선임기자 jskimhanicokr더불어 행복한 세상을 만드는 언론 한겨레 구독하세요네이버 채널 한겨레21 구독2005년 이전 한겨레 기사 보기ⓒ한겨레신문  무단전재 및 재배포 금지,https://news.naver.com/main/ranking/read.nhn?mid=etc&sid1=111&rankingType=popular_day&oid=028&aid=0002511093&date=20200901&type=1&rankingSectionId=105&rankingSeq=4
[속보]홍천서 감염 경로 불명 확진자 이틀간 5명 발생,속보홍천서 감염 경로 불명 확진자 이틀간 5명 발생 사진연합뉴스홍천과 원주에서 감염 경로가 확인되지 않은 코로나19 확진자가 연속 발생했다도 보건당국에 따르면 1일 홍천에서 코로나19 확진자가 두 명 발생했다　홍천군은 이날 오전 홍천읍에 거주하는 70대 A씨7번확진자가 코로나19 양성 판정을 받았다고 밝혔다 A씨의 구체적인 감염 경로는 아직 확인되지 않았다　A씨는 지난달 30일 홍천읍 흰돌감리교회에서 예배에 참석했으며 보건당국은 이날 대면 예배에 참석한 신도 9명에 대한 선별진료를 마쳤다 　홍천의 코로나19 누적 확진자 총 7명 가운데 면단위가 아닌 홍천읍내에서 확진자가 발생한 것은 이번이 처음이어서 군청과 보건당국이 바짝 긴장하고 있다　A씨는 지난달 29일 병원과 약국을 지난달 28일 홍천군 동면과 내촌면을 각각 다녀온 것으로 확인됐다 보건당국은 밀접접촉자 확인을 모두 마쳤으며 교회 예배실 외에 주민 접촉자는 없는 것으로 파악했다　홍천군은 또 이날 오후 A씨의 손주인 B학생8번 확진자이 감염됐다고 밝혔다 B학생은 현재 방학중으로 교내 접촉한 학생은 없는 상태다　앞서 지난 31일은 홍천에서 4번째 확진자의 가족 3명이 감염돼 이틀간 홍천지역에서만 5명이 늘었다하지만 이들의 최초 감염 경로는 좀처럼 파악되지 않고 있다원주에서는 70대 남성강원 190번째이 코로나19 양성으로 확인됐는데 이 환자 역시 감염 경로가 확인되지 않았다원주에서는 지난 16일 이후 현재까지 81명의 확진자가 발생했다 이 중 67명은 체조 교실을 고리로 한 확진으로 파악됐으나 나머지 14명은 감염 경로 불명 환자다원주시에 이어 화천군 홍천군 춘천시 등 지자체들이 마스크 착용 의무화 행정명령을 내리는 등 코로나19 방역에 안간힘을 기울이고 있다홍천에서는 오는 1일부터 버스 등 대중교통은 물론 집회와 공연 등 실외에서도 마스크 착용이 의무화된다마스크를 착용하지 않은 경우 실내외를 불문하고 2명 이상 집합도 제한된다춘천시도 10월 12일까지 계도기간을 거친 뒤 같은 달 13일부터는 벌금을 부과한다이와 함께 원주시는 자가격리 조치 위반자에 대해 수사 의뢰와 고발 등 한층 강력한 법적 조처를 하고 나섰다원주시는 이날 코로나19 자가격리 조치를 위반한 혐의로 주민 2명을 경찰에 고발하거나 수사 의뢰했다자가격리 장소를 벗어나 경기 가평 펜션에 있던 40대 남성이 고발됐고 자가격리 기간 중 자신의 승용차를 몰고 1시간가량 거주지를 무단이탈한 60대는 수사 의뢰됐다부족 사태에 허덕이던 코로나19 격리 음압병상은 원주의료원 30병상 추가 확충과 원주 생활치료센터 운영에 대한 주민 동의로 숨통이 트인 상태다현재 도내 운영 중인 음압병상은 106개로 92명의 확진자가 입원 치료 중이다 남은 병상은 14개다 오는 8일까지 78개 병상을 더 늘려 총 184개 병상이 운영된다도 보건당국은 마스크 착용과 2ｍ 이상 거리 두기 손 씻기 등 개인 방역 수칙을 철저히 준수해 달라며 노래연습장 PC방 유흥주점을 비롯한 고위험시설의 집합금지 이행 여부 등 사회적 거리 두기 2단계 조치를 철저히 점검하겠다고 말했다이태영기자 네이버에서 강원일보 구독하기 강원일보 네이버TV 바로가기ⓒ 강원일보  wwwkwnewscokr,https://news.naver.com/main/ranking/read.nhn?mid=etc&sid1=111&rankingType=popular_day&oid=087&aid=0000811909&date=20200901&type=1&rankingSectionId=102&rankingSeq=2
“하루 급여 47만원 드려요!”…그래도 품귀 ‘배달 라이더의 실상’ [IT선빵!],라이더 연 수익 1억시대 본격화 고액수익에도 라이더 품귀현상사회적 인식 교통사고 우려로 꺼려 배달지연 속출고객불편 커져헤럴드경제채상우 기자 “하루 급여 47만원까지 드려요”배달 라이더도 억대 연봉 시대다 코로나19로 배달이 급증하면서 라이더의 몸값이 천정부지로 치솟고 있다 그럼에도 라이더가 턱없이 부족한 실정이다 라이더 부족으로 배달 시간이 길어져 고객들의 불편이 잇따른다라이더 억대 연봉 시대“대기업 부럽지 않아요”쿠팡이츠에 따르면 지난달 30일 강남구에서 활동한 쿠팡이츠 라이더의 경우 최고 일 급여 47만 1100원을 받았다 주 5일 일한다고 가정할 경우 연 1억1200만원을 버는 셈이다 이 라이더는 이날 57건의 배달을 했다 건당 평균 배달비는 8200원이다해당 라이더만 수익이 유독 높은 것이 아니다 이날 강남 서초 송파 지역에서 활동한 쿠팡이츠 라이더들은 많게는 31만46만원의 수익을 거뒀다쿠팡이츠의 배달비는 기본요금 없이 주문량시간거리 등을 고려해 탄력요금제를 적용하고 있다 업계에 따르면 최소 5000원에서 장마철인 최근에는 평균 약 1만7000원을 지급하고 있다 많게는 건당 2만원대가 넘는 배달비를 지급하는 것으로 알려졌다경쟁사인 배달의민족 요기요 등도 쿠팡이츠 견제를 위해 배달비를 인상하면서 라이더 수익은 더욱 높아질 전망이다배달의민족 라이더의 경우 지난해 평균 약 4800만원을 벌었다 상위 10 라이더의 경우 7500만원을 벌었다 경쟁사인 요기요 및 배달대행사 소속 라이더들도 배달의민족과 비슷한 수준인 것으로 알려졌다배달의민족 배달라이더 우아한형제들 제공라이더 품귀현상“배달 지연에 고객은 너무 불편해요”그럼에도 배달업계는 라이더를 구하기 쉽지 않은 상황이다 라이더를 낮게 취급하는 사회적 인식과 교통사고 위험을 감수해야 하는 리스크 때문에 지원자가 많지 않다는 게 업계 관계자의 설명이다더욱이 사회적 거리두기 25단계에 따라 배달 수요가 급증하는 가운데 라이더 수급이 제대로 되지 않아 업체들마다 골머리를 앓고 있다 사회적 거리두기 3단계 가능성이 제기되고 있고 태풍까지 예고돼 있다배달 수요는 많이 늘어나고 있지만 정작 배달을 해야 할 라이더들은 턱없이 부족한 실정이다업계 관계는 “라이더가 부족해 배달 시간도 길어질 수밖에 없는 상황”이라고 말했다배달업계에 따르면 배달지연율은 갈수록 증가하는 추세다 배달지연율이란 전체 배달 중 배달시간이 40분을 초과하는 비율이다123heraldcorpcom엄마들이 꼽은 NO1 화상영어무료체험헤럴드경제 네이버 채널 구독 농수축산물 소비캠페인  Copyrights ⓒ 헤럴드경제  heraldbizcom 무단 전재 및 재배포 금지 ,https://news.naver.com/main/ranking/read.nhn?mid=etc&sid1=111&rankingType=popular_day&oid=016&aid=0001719122&date=20200901&type=1&rankingSectionId=105&rankingSeq=2
"[속보]평택 굿모닝병원 간호사 확진…""확진자 응급처치 중 감염""",사진평택시 홈페이지아시아경제 허미담 기자 경기 평택시는 20대 A평택 98번씨가 신종 코로나바이러스 감염증코로나19 확진 판정을 받았다고 1일 밝혔다굿모닝병원 응급실 간호사인 A씨는 지난달 31일 이 병원 선별진료소를 찾았다가 응급실로 옮겨진 B평택 97번씨를 기도삽관 등 응급조치하는 과정에서 감염된 것으로 추정된다B씨는 병원을 찾은 다음 날인 이달 1일 확진돼 지정 병원으로 옮겨졌다B씨가 내원할 당시 굿모닝병원 응급실에 있었던 의료진과 환자 등 17명은 진단 검사 결과 간호사 A씨를 제외한 모두가 음성 판정을 받았다허미담 기자 damdamasiaecokr 2020년 하반기 재물운연애운건강운 체크 네이버에서 아시아경제 뉴스를 받아보세요 놀 준비 되었다면 드루와  드링킷ⓒ경제를 보는 눈 세계를 보는 창 아시아경제 무단전재 배포금지,https://news.naver.com/main/ranking/read.nhn?mid=etc&sid1=111&rankingType=popular_day&oid=277&aid=0004747451&date=20200901&type=1&rankingSectionId=102&rankingSeq=1
