Title,Contents,link
"건너편車에 ""오지마"" 다급한 손짓…30초 뒤, 다리 무너졌다 [영상]",50대 박모씨 평창 송정교 균열 발견 후 진입 막아다리 절반 건너온 차량붕괴 직전 가까스로 탈출수신호 발빠른 주민 기지대형 인명 피해 막아  평창 송정교 균열 발견 후 진입 막은 50대 박모씨제9호 태풍 마이삭’이 강타한 3일 강원 평창에서 다리가 무너지기 불과 30초 전 한 남성이 수신호로 차량 진입을 막아 인명피해를 막았다평창군에 따르면 이날 오전 진부면 하진부리 시가지와 송정리를 잇는 송정교길이 150m폭 8m가 급격히 불어난 강물에 유실됐다 군 관계자는 사고 이후 주변 폐쇄회로TVCCTV에서 붕괴 직전에 놓인 송정교 입구에서 한 지역 주민이 차량 진입을 막는 장면을 발견했다영상에 담긴 주민은 오전 7시28분 25초쯤 다리 건너편에서 승용차가 진입하자 황급히 뛰쳐나갔다 손사래 치듯 손을 좌우로 흔들고 차량을 향해 뒤로 물러나라고 경고했다 다리를 절반가량 지난 승용차는 주민이 보낸 신호를 확인한 뒤 황급히 비상등을 켜고 후진했다 이 주민은 승용차가 후진하는 중에도 계속해서 뒤로 가라고 손짓했고 다리에 진입하려는 또 다른 차량에도 손을 가로저으며 진입을 말렸다 3일 강원 평창군 진부면 하진부리 송정교가 제9호 태풍 마이삭에 불어난 강물로 일부 유실돼 있다 연합뉴스송정교는 이 남성이 다리로 뛰쳐나온 지 불과 30초가 지난 후인 오전 7시28분 55초쯤 일부가 주저앉으며 강물로 유실됐다 사고를 막은 주민은 다리 근처에 사는 50대 박모씨로 알려졌다 당시 박씨와 함께 차량 통제에 나섰던 홍준균48 송정4리 이장은 “오전 7시쯤 박씨에게 큰일났다 다리가 이상하다 이 상태로 가면 위험할 것 같다’는 전화를 받았다”고 말했다 박씨는 다리가 살짝 내려낮는 모습을 목격하고 이날 오전 7시부터 차량 통행을 막다가 홍 이장에 도움을 요청했다고 한다박씨는 다리가 유실된 이후로도 소방대원과 경찰관 등과 함께 오전 9시까지 다리를 떠나지 않고 차량 통제를 도왔다 홍 이장은 “출근 시간대인 데다가 다리 인근에 주거지가 밀집해 있어 박씨가 다리 균열을 발견하지 못했더라면 큰 사고가 날뻔했다”고 말했다 평창군에 따르면 이번 태풍으로 진부면에는 225㎜가 넘는 폭우가 쏟아졌다  최종권 기자 평창박진호 기자 choigojoongangcokr넌 뉴스를 찾아봐 난 뉴스가 찾아와 그래서 팩트가 뭐야 궁금하면 팩플 세상 쉬운 내 돈 관리 그게머니ⓒ중앙일보httpsjoongangcokr 무단 전재 및 재배포 금지,https://news.naver.com/main/ranking/read.nhn?mid=etc&sid1=111&rankingType=popular_day&oid=025&aid=0003032093&date=20200904&type=2&rankingSectionId=102&rankingSeq=1
"호랑이 주요 부위 잡고 사진 찍은 여성…""무례하다"" 비난 봇물",  호랑이의 고환을 잡고 사진을 찍어 무례하다는 비판을 받은 태국 여성의 사진 연합뉴스동물원에서 호랑이 고환을 움켜쥔 채 사진을 찍은 태국 여성이 뭇매를 맞고 있다3일 미국 뉴욕포스트 등에 따르면 태국 방콕에 거주하는 와라스차야 아카라차이야파스는 최근 치앙마이의 한 동물원에서 호랑이와 함께 찍은 사진들을 페이스북에 올렸다하지만 이들 사진 중 일부는 네티즌들로부터 무례하다는 비판을 받았다 아카라차이야파스가 누워 있는 호랑이의 고환을 한 손으로 부여잡은 모습이 담겼기 때문이었다한 네티즌은 호랑이가 자신의 주요 부위를 만지도록 허락하지 않았다며 당신에겐 그럴 권리가 없다고 지적했다고 폭스뉴스는 전했다또 다른 누리꾼은 이건 위험한 행위라며 호랑이가 공격할 수도 있다고 말했다비난이 거세지자 아카라차이야파스는 본인이 동물 애호가라고 주장했다 논란이 된 사진들도 페이스북에서 삭제했다누워 있는 호랑이와 함께 사진을 찍은 태국 여성 이 여성은 호랑이의 주요 부위를 잡은 모습이 담긴 사진을 올려 뭇매를 맞았다 연합뉴스해당 동물원 측은 아카라차이야파스의 행위는 자체 규정에 어긋난다는 성명을 냈다동물원 관계자는 관람객들이 호랑이 고환을 만지지 못하게 돼 있지만 전문가들이 동행하는 한 호랑이의 다른 모든 부위는 만질 수 있다며 앞으로 이런 일이 일어나지 않도록 하겠다고 밝혔다태국 동물원은 관광객이 사진을 찍을 수 있도록 동물을 마취시킨다는 사실이 밝혀져 논란이 일기도 했다고 뉴욕포스트는 전했다김지혜 기자 kimjihye6joongangcokr넌 뉴스를 찾아봐 난 뉴스가 찾아와 그래서 팩트가 뭐야 궁금하면 팩플 세상 쉬운 내 돈 관리 그게머니ⓒ중앙일보httpsjoongangcokr 무단 전재 및 재배포 금지,https://news.naver.com/main/ranking/read.nhn?mid=etc&sid1=111&rankingType=popular_day&oid=025&aid=0003032090&date=20200904&type=1&rankingSectionId=104&rankingSeq=1
"김태년 '8분' 발언 불편한 이낙연 대표? ""간결히 말해달라""",  더불어민주당 이낙연 대표왼쪽부터 김태년 원내대표 김종민 최고위원 등이 2일 오전 서울 여의도 국회에서 열린 제2차 최고위원회의에 입장하고 있다 연합뉴스  “메시지 관리를 좀 해달라”  이낙연 더불어민주당 대표가 지난달 31일 당 지도부와의 첫 만찬을 주재하면서 김태년 원내대표와 김종민염태영노웅래신동근양향자 최고위원을 향해 건넨 말이다 이 대표는 이 자리에서 “메시지를 간결하게 할 필요도 있고 현재는 발언 시간도 좀 길다”면서 최고위원회 공개발언을 가다듬어 달라고 당부했다고 한다 첫 최고위원회 회의를 가진 뒤 본인이 생각하는 문제점을 공유하는 차원이었다고 한다 이날 오후 2시30분부터 시작한 최고위는 30분 만에 끝내기로 사전에 정해져 있었다고 한다 오후 3시에 이 대표가 박병석 국회의장을 찾아 인사하는 일정이 잡혀있었기 때문이다 이를 고려한 듯 이 대표는 3분 만에 발언을 마쳤다  문제는 다음부터였다 김 원내대표가 8분 김종민 최고위원이 6분간 발언하면서다 원고 없이 즉흥 연설한 김 최고위원이 발언을 마친 뒤 사회를 보던 오영훈 당 대표 비서실장은 “대표께서 오후 2시 57분에 박병석 국회의장을 만나기 위해 이동해야 한다 발언 시간에 참고해달라”고 공지하기도 했다 발언을 서둘러달라’는 주문이었는데도 회의 끝 무렵 “한 말씀 만”이라며 추가 발언에 나선 김 원내대표가 “저도 능동감시자가 됐었다”로 시작하는 자가격리 소회를 늘어놓자 이 대표는 슬며시 그를 쳐다봤다 의사봉을 세 차례 두드리며 산회를 선포한 이 대표는 오후 2시 58분에 황급히 자리를 떴다 한 참석자는 “중언부언을 꺼리는 이 대표 성향상 첫 최고위 상황에 심기가 불편했을 수 있다”고 했다  더불어민주당 지도부가 지난달 31일 오후 서울 동작구 국립서울현충원을 방문 현충탑에 참배하고 있다 앞줄 오른쪽부터 양향자 염태영 김종민 최고위원 김태년 원내대표 노웅래 신동근 최고위원 연합뉴스이 대표가 주재하는 회의는 상당한 집중력이 필요하다는 게 경험자들의 중론이다 전남지사와 국무총리를 역임하던 시절 주제를 벗어난 발언을 하면 “회의와 관련이 없는 얘기”라고 지적하고 잘못된 표현을 쓴 참석자에겐 “이런 표현이 맞다”고 교정해주는 경우가 종종 있었다고 한다 그중에서도 이 대표가 꺼리는 건 핵심을 짚지 못하고 시간만 길어지는 경우다 이 대표의 한 측근은 “회의시간이 길어지는 것을 좋아하지 않고 간결해야 한다는 게 이 대표 지론”이라며 “그런 성향을 눈치껏 알아야 한다”고 했다  이를 감지한 최고위원들은 지난 2일 2차 최고위를 마친 뒤 한자리에 모여 향후 발언 시간과 메시지 등을 논의했다고 한다 한 최고위원이 “당대표와 원내대표 발언보다 길게 하지 말자”고 제안했고 또 다른 최고위원은 “최고위원들 메시지가 겹치면 안 되니 미리 분야를 나누자”라고 말했다고 한다 최고위원들의 일사불란한 모습에 자리에서 일어나던 이 대표도 “한번 논의해보시라”며 흡족해하는 모습이었다고 한다  결국 최고위원들은 당대표원내대표 발언약 5분보다 짧은 23분 정도로 발언을 마치기로 정했다 분야도 나눴는데 법제사법위원회 소속인 김종민 최고위원은 검찰 등 사법 부문을 수원시장인 염태영 최고위원은 지방분권을 맡기로 했다 MBC 기자 출신 중진인 노웅래 최고위원은 미디어 및 외교안보 부문을 치과의사 출신 신동근 최고위원은 사회의료를 삼성전자 상무 출신 양향자 최고위원은 산업경제 부문을 담당하기로 했다 메시지도 회의 전에 사전 조율하기로 약속했다박성민 민주당 최고위원 페이스북 캡처또 최고위원 자리도 사안마다 바꾸기로 했다 중대 사안이 있으면 특정 분야를 맡은 최고위원이 이 대표 왼쪽인 수석최고위원 자리에 앉아 발언하게 하는 것이다 한 최고위원은 “청년을 대표하는 박성민 최고위원 같은 분들이 좀 더 조명받게 하기 위한 것”이라고 했다  다른 한 최고위원은 “봉숭아학당처럼 되면 안 된다 할 말이 있다면 비공개회의에서 하면 될 것”이라며 변화’에 힘을 실었다 그러나 한 수도권 중진 의원은 “당대표가 유력 대선주자인 상황인데 이제는 눈치를 더 보게 될 것”이라며 곱지 않은 시선을 드러냈다김효성 기자 kimhyoseongjoongangcokr넌 뉴스를 찾아봐 난 뉴스가 찾아와 그래서 팩트가 뭐야 궁금하면 팩플 세상 쉬운 내 돈 관리 그게머니ⓒ중앙일보httpsjoongangcokr 무단 전재 및 재배포 금지,https://news.naver.com/main/ranking/read.nhn?mid=etc&sid1=111&rankingType=popular_day&oid=025&aid=0003032199&date=20200904&type=1&rankingSectionId=100&rankingSeq=5
[속보]정부 의료계 협상타결 의사휴진 끝난다, 파이낸셜뉴스  ck7024fnnewscom 홍창기 기자헉 소리나는 스토리 뉴스 헉스 아는 척하고 싶은 당신을 위한 두유노우저작권자 ⓒ 파이낸셜뉴스 무단 전재재배포 금지,https://news.naver.com/main/ranking/read.nhn?mid=etc&sid1=111&rankingType=popular_day&oid=014&aid=0004488530&date=20200904&type=1&rankingSectionId=100&rankingSeq=2
[속보]민주-대한의협과 5개 합의문 최종 합의…오전 8시30분 서명식,한정애 더불어민주당 신임 정책위의장이 1일 서울 여의도 국회에서 열린 원내대책회의에서 발언을 하고 있다 20200901뉴스1 © News1 성동훈 기자dalnews1kr 네이버 메인에서 뉴스1 구독하기  뉴스1 바로가기코로나19 뉴스 © 뉴스1코리아news1kr 무단 전재 및 재배포 금지,https://news.naver.com/main/ranking/read.nhn?mid=etc&sid1=111&rankingType=popular_day&oid=421&aid=0004852399&date=20200904&type=1&rankingSectionId=100&rankingSeq=3
'3% 수익률 보장' 결국 없던 일로...'시중 유동성 흡수 한계' 지적도,공적자금 7조민간자금 13조베일벗은 뉴딜펀드사실상 원금 보장 수준 될듯국고채보다 높은 금리는 가능이데일리 이승현 기자 문재인 정부가 뉴딜펀드의 구체안을 발표했다 지난 7월 포스트 코로나’ 전략으로 한국판 뉴딜정책의 밑그림을 내놓은 정부는 이를 실현하기 위한 뉴딜펀드를 조성해 뉴딜사업에 대대적인 민간 투자를 이끌어낸다는 복안이다이데일리 김정훈 기자애초 정부와 여당은 민간 뉴딜펀드 투자 독려를 위해 3 수익률 보장’ 등을 언급했지만 이날 공개된 구체안에선 사실상 원금보장’으로 수위가 낮아졌다정부는 3일 국민참여형 뉴딜펀드 조성 및 뉴딜금융 지원 방안’ 발표에서 총 20조원 규모로 조성할 정책형 뉴딜펀드에 대한 구체적 수익률을 제시하지 않았다 투자상품이기 때문에 확정된 수익률을 제시할 수 없다는 이유에서다다만 은행 정기예금이나 국고채에 비해선 높은 수익률을 추구할 것이라며 3 수익률은 사실상 어렵다는 점을 시사했다 현재 은행권에서 1년 만기 정기예금 평균금리는 08 수준이다 국고채 수익률은 3년물 0923 10년물 1539다 은성수 금융위원장은 이날 브리핑에서 “정책형 뉴딜펀드가 장기이긴 하지만 사실상 원금이 보장되고 국고채보다 더 높은 금리를 제시할 수 있다면 좋은 투자처가 될 것”이라고 말했다 3 손실나도 민간자금 원금은 보장정책형 뉴딜펀드는 정부 재정 등 공적자금으로 7조원을 금융기관과 일반 국민 등 민간 자금이 13조원을 매칭하는 방식이다 공적자금은 후순위로 민간자금이 선순위로 출자되는 구조로서 투자손실이 나더라도 후순위로 출자한 정부가 손실을 메울 수 있다고 설명했다 공적자금이 35가량 투자될 예정인 만큼 35까지 손실이 나더라도 민간자금은 원금을 보장할 수 있다는 것이다 금융위 관계자는 “재정이 먼저 손실의 10까지 부담하고 손실이 커지면 정부와 정책금융기관이 구체적인 위험분담 비율을 결정할 계획”이라고 말했다 투자대상은 뉴딜사업과 관련한 모든 곳이 가능하다 정부는 투자대상으로 △그린 스마트 스쿨수소충전소 구축 등 뉴딜 관련 민자사업 △수소전기차 개발 프로젝트 등 뉴딜 프로젝트 △데이터 센터디지털 SOC 안전관리시스템친환경 및 신재생에너지 시설 등 민자사업 외 뉴딜 인프라 △뉴딜 분야 창업벤처기업 중소주력기업 등을 예로 들었다중소기업뿐 아니라 에 더해 대기업 투자도 가능하다 수소전기차 개발 프로젝트나 데이터 센터 구축 등은 대기업 영역으로 분류된다 홍남기 경제부총리는 “대기업과 중소기업이 같이 공동프로젝트를 할 때 지원 필요성이 크면 대기업도 투자대상이 된다고 볼 수 있다”고 말했다 정부는 이달 중 투자 대상에 대한 가이드라인을 마련할 계획이다뉴딜펀드는 이들 기업의 주식이나 채권 메자닌 증권전환사채신주인수권부사채교환사채 등 등을 인수하거나 대출을 해줄 계획이다 뉴딜펀드 운용사 모집 공고와 선정 자펀드 결성운용 등은 한국성장금융과 산업은행이 맡는다정부는 일반 국민이 쉽게 참여하도록 증권사와 함께 시중은행에서도 뉴딜펀드를 판매하겠다는 방침이다퇴직연금도 투자 가능정부는 이와 함께 뉴딜 인프라펀드 육성과 민간 뉴딜펀드 활성화 방안도 제시했다뉴딜 인프라펀드는 정책형 뉴딜펀드와 민간 자율의 인프라펀드 등을 활용해 조성한다 현재 민간에서 운영되는 인프라펀드는 586개 정도다 정부는 이 중 뉴딜 인프라에 50 이상을 투자하는 공모 인프라펀드의 경우 배당소득에 대해 저율과세 혜택을 줄 방침이다 최대 2억원의 투자금액에 대한 배당소득에 대해 9의 분리과세를 적용할 예정이다 이는 세법 개정안에서 공모 인프라펀드에 대해 투자금액 1억원까지 배당소득에 14의 세율로 분리과세키로 한 것보다 혜택을 더 늘린 것이다 공공부문 발주 민자사업에 투자하는 인프라펀드에 대해선 산업기반신용보증 지원과 해지시 지급금 등으로 위험 부담을 덜어줄 방침이다 또 퇴직연금이 뉴딜 인프라펀드에 투자할 수 있도록 제도 정비에도 나선다 퇴직연금 투자 대상에 정부 등이 원리금 지급을 보장하는 민자사업 대상 채권을 포함토록 제도를 개선할 예정이다한국거래소는 뉴딜업종 상장기업 종목들을 추종하는 이른바 뉴딜지수’를 개발할 계획이다 이를 바탕으로 인덱스펀드와 ETF 등 뉴딜지수 연계 투자상품도 출시토록 유도한다는 방침이다뉴딜기업에 대한 대규모 자금공급도 마련됐다정부는 뉴딜기업을 대상으로 대출프로그램과 특별보증 등으로 5년간 100조원을 저리로 대출해줄 계획이다 금융권에선 신한KB하나우리NH농협 등 5대 금융지주회사가 5년간 약 70조원 이상을 대출 및 투자키로 했다 정부는 뉴딜기업에 자금을 적극 공급하도록 은행 국제결제은행BIS 비율과 보험사 지급여력비율RBC 등 자본건전성 규제도 완화해줄 방침이다홍남기 부총리는 뉴딜펀드에 대한 정부의 재정 및 세제지원이 과도하다는 지적에는 선을 그었다 그는 “뉴딜사업이 대부분 투자기간이 길고 공공적 성격이 강해 이러한 공적지원이 필요하다고 판단했다”며 “자본시장을 왜곡하는 경우는 없을 것으로 본다”고 말했다이승현 leeshedailycokr 24시간 빠른 미리보는 뉴스 eNews 네이버에서 이데일리 뉴스를 만나보세요 빡침해소 청춘뉘우스 스냅타임＜ⓒ종합 경제정보 미디어 이데일리  무단전재  재배포 금지＞,https://news.naver.com/main/ranking/read.nhn?mid=etc&sid1=111&rankingType=popular_day&oid=018&aid=0004729637&date=20200904&type=1&rankingSectionId=101&rankingSeq=1
