Title,Contents,link
"특검 징역 6년 구형에 반발한 김경수…""무조건 유죄 만들기""",머니투데이 임찬영 기자 드루킹 댓글 조작 공모 혐의로 기소된 김경수 경남도지사가 지난 3일 오후 서울 서초구 서울고등법원에서 열린 컴퓨터등장애업무방해 등 항소심 공판에 출석하며 취재진의 질의에 답하고 있다사진 뉴스1포털사이트 댓글조작 혐의를 받는 김경수 경남도지사53가 자신의 항소심 최후진술에서 특검이 김경수 유죄 만들기를 하고 있다며 비판했다 이날 결심공판에서 특검은 원심 때와 같이 김 지사에게 총 징역 6년을 구형했다━특검 징역 6년 구형  공소사실 모두 입증돼━서울고법 형사2부부장판사 함상훈는 3일 오후 2시 컴퓨터 등 장애업무방해 공직선거법 위반 등 혐의로 기소된 김 지사의 항소심 결심공판을 진행했다 이날 특검은 컴퓨터 등 장애업무방해 혐의에 징역 3년 6개월을 공직선거법 위반 등 혐의에 징역 2년 6개월을 선고해달라고 재판부에 요청했다특검은 특정인 진술에 의존하지 않고 객관적인 증거를 제출했고 1심과 항소심에서도 이어왔다며 공판 과정 심리를 이어온 결과 2017년 대선과 2018년 지방선거에서 불법적으로 선거에 개입하고 선거의 공정성을 해친 과정이 드러났다고 밝혔다이어 그 결과 여론 왜곡이라는 중대한 위법행위가 발견됐고 이와 관련한 공소사실은 충분히 입증됐지만 그럼에도 원심 형은 이 사건 범죄 실질과 중요성에 비해 낮다며 허위 주장에 대한 구체적인 의견은 별도 서면을 토대로 하고 구형을 그대로 유지하겠다고 말했다앞서 1심에서 검찰은 항소심과 동일하게 김 지사에게 총 징역 6년을 구형했다 그러나 1심은 김 지사의 혐의를 모두 유죄로 판단하면서도 컴퓨터 등 장애업무방해 혐의에 징역 2년 공직선거법 위반 혐의에 대해서는 징역 10개월에 집행유예 2년을 선고했다 이에 따라 김 지사는 법정구속됐지만 지난해 4월 보석을 허가받아 석방돼 경남도지사직을 수행하고 있다━김경수 혐의 전면 부인  무조건 유죄 만들기냐━드루킹 댓글 조작 공모 혐의로 기소된 김경수 경남도지사가 3일 오후 서울 서초구 서울고등법원에서 열린 컴퓨터등장애업무방해 등 항소심 공판에 출석하고 있다 사진뉴스1김 지사는 최후진술에서 진실을 밝혀야 할 의무가 가진 특검의 존재 의무에 대해 심각하게 묻지 않을 수 없다며 실체적 진실을 밝히는 게 목적인지 아니면 저나 고故 노회찬 의원 같이 김동원과 관계만 있으면 유죄로 만드는 게 목적인지 심각하게 문제제기 하지 않을 수 없다고 밝혔다이어 미처 보지 못했던 특검 증거자료를 항소심 과정에서 살펴보니 특검이 제게 유리한 증거를 무시하고 수사 보고서조차 제게 불리하게 왜곡해 심지어 조작된 수사 보고에 맞춰 경공모 진술을 꾀어 맞춘 상황이 드러났다며 특검이 원하는 게 실체적 진실을 밝히는 건지 아니라면 무조건 김경수 유죄 만들기인지 묻지 않을 수 없다고 말했다이날 김 지사는 댓글조작으로 실형을 선고받고 복역 중인 드루킹 김동원씨가 자신을 모함하고 있다고도 주장했다김 지사는 김동원은 자신의 필요에 의해 킹크랩을 만들어 놓고 누군가에게 뒤집어 씌어서 피해자로 만드는 게 목적이 아니었나 싶다며 그래야 경공모 회원들에게 김경수가 우릴 이용하고 버린 것이라 생각하게 해 출소하면 회원들과 재기할 기반을 만드려고 했던 게 아닌가 하는 의문도 든다고 말했다또 두 분 대통령을 모셨단 이유로 지지자들이 수시로 찾아왔지만 성심성의껏 응대하고 찾아가서 뵙는 게 두 대통령을 모셨던 제 기본적인 도리라고 생각했다며 그런 제 노력을 자신의 조직과 이해관계 위해 악용하고 불법 이익 챙기려 했다나고 여기는 게 이 사건의 본질이라고 생각한다고 주장했다김 지사는 드루킹 김동원씨 등과 공모해 2016년 12월부터 2018년 4월까지 네이버 다음 등 포털사이트에서 기사 댓글과 추천 수 등을 조작해 댓글순위 산정업무를 방해한 혐의로 재판에 넘겨졌다 또 자신이 출마한 613지방선거를 도와주는 대가로 김씨 측에 일본 센다이 총영사직을 제안한 혐의도 있다김 지사에 대한 2심 선고는 올 11월 6일 내려진다 제출된 범죄일람표 관련 양측 입장이 다르기 때문이 이를 다음달 5일까지 정리하는 시간을 갖기로 했다 이로써 1년6개월 가량 지속됐던 김 지사에 대한 2심도 11월 초면 마무리 될 것으로 보인다임찬영 기자 chan02mtcokr줄리아 투자노트조 변호사의 가정상담소 머니투데이 구독하기 저작권자 ⓒ 돈이 보이는 리얼타임 뉴스 머니투데이 무단전재 및 재배포 금지,https://news.naver.com/main/ranking/read.nhn?mid=etc&sid1=111&rankingType=popular_day&oid=008&aid=0004466078&date=20200904&type=1&rankingSectionId=102&rankingSeq=4
"""샤워후 마스크부터 쓴다""는 어린이...KBS아나운서 ""야한데?""",  사진 KBS홈페이지 캡처KBS2라디오 이상호의 드림팝 제작진이 진행자인 이상호44 아나운서의 발언 논란에 대해 공식으로 사과했다  제작진은 3일 어린이 마스크 착용 사연과 관련해 진행자의 부적절한 발언으로 청취자분들께 불편함과 심려를 끼친 점 사과의 말씀을 드린다고 밝혔다  이어 코로나19로 심각한 국면에서 적절치 못한 농담은 자제했어야 함이 마땅하나 국민의 정서를 미처 헤아리지 못하고 부주의했음을 뒤늦게나마 인지하고 거듭 사죄드린다고 했다  문제의 발언은 전날 진행된 라디오 생방송에서 한 청취자의 사연을 소개하는 가운데 나왔다 사연은 여섯 살 아들이 씻고 나오면 속옷도 안 입고 마스크부터 쓰고 나온다는 내용이었다 이 아나운서는 이를 읽은 뒤 귀엽다며 웃다가 조금 야한데 마스크만 쓰고라고 말했다방송 이후 해당 프로그램 청취자 게시판에는 어린이에게 야하다는 표현이 가당키나 하냐 등 이 아나운서의 표현을 문제 삼는 민원이 이어졌다  김은빈 기자 kimeunbinjoongangcokr넌 뉴스를 찾아봐 난 뉴스가 찾아와 그래서 팩트가 뭐야 궁금하면 팩플 세상 쉬운 내 돈 관리 그게머니ⓒ중앙일보httpsjoongangcokr 무단 전재 및 재배포 금지,https://news.naver.com/main/ranking/read.nhn?mid=etc&sid1=111&rankingType=popular_day&oid=025&aid=0003032027&date=20200904&type=1&rankingSectionId=103&rankingSeq=2
"""공무원은 시키는대로 할 뿐""…'집단 무기력증' 빠진 경제관료들",포퓰리즘 광풍에도경제관료들은 예스방만 재정 등 주요 정책 黨靑이 주도부처는 실무만정치권 뒤치다꺼리만 하는 하도급 기술자로 전락 자초청와대와 거대여당이 정책을 일방적으로 밀어붙여도 관료들이 제 목소리를 내지 못한다는 비판이 제기되고 있다 지난 3월 비상경제회의 후 브리핑에 나선 박능후 보건복지부 장관왼쪽부터 진영 행정안전부 장관 홍남기 부총리 겸 기획재정부 장관 성윤모 산업통상자원부 장관 이재갑 고용노동부 장관  한경DB“나랏빚이 올해 110조원 내년에 105조원 증가합니다 이렇게 국가채무가 급증하게 재정계획을 세워도 되는 건가요”한 전직 경제부처 고위 공직자는 3일 기획재정부가 발표한 내년 예산안과 중기 재정전망을 본 뒤 이같이 말했다 그는 “정치권에서 신종 코로나바이러스 감염증코로나19 극복을 명분으로 나랏돈을 흥청망청 쓰겠다는 것 같은데 공무원들까지 큰 반대 없이 그 생각에 동조해도 되는지 이해할 수 없다”며 “경제 관료들이 권력에 줄서고 정치권 뒤치다꺼리나 하는 하도급 기술자로 전락한 것 같다”고 씁쓸해했다 문재인 정부 들어 경제 관료들의 존재감이 사라지고 있다 초반에는 최저임금의 급격한 인상 무차별적인 주 52시간 근로제 적용 현실을 고려하지 않은 탈원전 정책 등이 추진됐지만 반대 목소리가 경제부처에서 제대로 나오지 않았다 경제 관료들의 출세지향주의와 무력감은 정권 중반을 넘어선 요즘 정도가 더 심해지고 있다는 지적을 받고 있다 나랏돈 풀기 규제 일변도의 부동산 정책 과세 원칙에 어긋나는 소수에 대한 징벌적 과세 등의 포퓰리즘대중인기영합주의 정책이 추진돼도 소신을 갖고 제동을 거는 경제 관료는 사라졌다 관가에선 “문재인 정부는 경제 관료들의 무덤”이란 얘기까지 나오고 있다사정이 이렇다 보니 정치권의 포퓰리즘 경쟁은 더 심해지고 있다 대선 후보 중 한 명으로 꼽히는 이재명 경기지사는 “재난지원금을 50번 100번 줘도 괜찮다”고 하더니 “국가채무가 증가하니 재정지출을 늘리지 말아야 한다는 논리는 매우 악의적인 주장”이라고까지 했다 김종인 비상대책위원장이 이끄는 국민의힘은 보수정당의 기본가치인 자유민주주의와 시장경제가 아니라 기본소득을 최고 가치로 내세웠다성태윤 연세대 경제학부 교수는 “경제 관료들은 정치권의 편향적 정책을 그대로 받아들일 것이 아니라 국민에 대한 봉사자라는 태도로 일해야 한다”고 지적했다관료적 전문성은 어디로유례없는 징벌적 조세정책에도기재부 반대 목소리 없어노무현 전 대통령은 재임 시절 경제정책을 전문 관료들에게 맡겼다 정통 경제관료 출신인 이헌재 부총리 겸 재정경제부 장관이 대표적이다 그는 386 청와대 실세들과 번번이 충돌하면서도 신용카드 대란 직후 경제살리기와 한미 자유무역협정FTA 토대 마련 등을 관철시켰다 배경에는 “정치적으로 손해지만 국가를 위해 반드시 해야 한다”며 경제관료에 힘을 실어줬던 노 전 대통령이 있었다노무현 정부를 계승했다는 문재인 정부는 반대로 시작부터 경제관료를 적대시했다 “관료를 쓰면 개혁이 물 건너간다”이정우 전 청와대 정책실장는 노무현 정부 실세들의 시각이 반영된 결과다 2017년 김진표 당시 국정기획자문위원장은 취임 직후 “보수 정부 10년간 정부 관료들이 흘려들었던 우리의 국정 철학을 뼈저리게 느끼게 할 것”이라고 말하기도 했다 국정기획위는 현 정부 국정 운영 방향의 밑그림을 그린 곳이다문재인 정부는 정책 방향과 다른 목소리를 내는 경제관료에게 유독 가혹했다 김동연 전 부총리 겸 기획재정부 장관이 대표적이다 김 전 부총리는 문재인 정부 초기부터 혁신성장 정책을 중점적으로 추진했지만 소득주도성장을 밀어붙이는 장하성 당시 청와대 정책실장과 대립각을 세웠다 급기야 2018년 11월 국회에서 “경제에 관한 정치적 의사결정’의 위기가 있다”고 밝힌 뒤 나흘 만에 경질됐다여야가 포퓰리즘대중인기영합주의 정책을 쏟아내고 있지만 홍남기 부총리 겸 기재부 장관과 성윤모 산업통상자원부 장관 은성수 금융위원장 등 관료 출신 장관들이 이견을 내지 않는 것도 이런 학습효과 때문이라는 분석이다이러는 사이 정치권의 정책 주도권은 커지고 있다 이낙연 더불어민주당 대표는 탈원전과 복지지출 확대 등 문재인 정부의 정책을 계승할 것을 밝히고 있다 야당 대표인 김종인 국민의힘 비상대책위원장마저 현 정부 정책기조와 비슷한 기본소득과 경제민주화를 전면에 내세웠다그럼에도 경제부처 공무원들은 반기를 들지 않는다 잘못된 경제정책이 부작용을 초래할 것을 알면서도 출세를 위해 때로는 반대해 봐야 바뀔 게 없다는 체념과 무기력 속에 하도급 기술자’ 역할에 머물고 있다는 지적이다기재부 세제실이 대표적 사례다 세제실은 작은 세율 변화 하나도 각 경제주체의 행위에 영향을 주기 때문에 원칙과 경제 영향을 중시한다 그런 공무원들이 요즘 정치권이 밀어붙이는 원칙 없는 세금 정책을 뒷받침하는데 몰두하고 있다 청와대가 밀어붙여 세법개정안에 반영된 부자 증세’가 그랬다 기재부는 연 10억원 이상 고소득자의 소득세 최고세율을 45로 올리면서 “세금을 더 내게 되는 사람은 근로소득세를 내는 사람의 005에 불과하다”고 설명했다 정부의 한 관계자는 “고소득자 수가 적으니 더 걷어도 별 상관없다는 건 조세 원칙이 아니라 정치”라고 했다다른 경제부처 공무원도 마찬가지다 공정거래위원회는 요즘 네이버 카카오 등 플랫폼 사업자에 대한 정부 규제안을 마련하느라 분주하다 당초 공정위는 12년 정도 시장 상황을 지켜보며 규제 여부를 신중하게 따져볼 생각이었다 섣불리 규제를 만들었다가는 산업 경쟁력이 약화돼 외국 플랫폼 기업들의 배만 불리는 결과를 낳을지 모른다는 우려에서다 하지만 여당이 “빨리 규제안을 마련하지 않으면 우리 마음대로 하겠다”고 하는 바람에 부랴부랴 연말을 목표로 정부안을 준비 중이다홍기용 인천대 경영학부 교수는 “과거 정부에서는 정치권이 관료들의 전문성을 인정해주는 분위기였지만 최근 들어 자율성이 약화됐다는 이야기가 나온다”며 “포퓰리즘으로 폭주하는 입법부를 막기 위해서는 관료가 제 역할을 해줘야 한다”고 말했다성수영정인설노경목 기자 syounghankyungcom 믿고 보는 기자 한경 기자 코너 네이버에서 한국경제 뉴스를 받아보세요 모바일한경 구독신청 ⓒ 한국경제  hankyungcom 무단전재 및 재배포 금지,https://news.naver.com/main/ranking/read.nhn?mid=etc&sid1=111&rankingType=popular_day&oid=015&aid=0004410056&date=20200904&type=1&rankingSectionId=101&rankingSeq=5
‘마이삭’ 진로 제대로 짚은 기상청… ‘하이선’ 경로도 적중할까,부정확한 장마 예보 원성 샀지만  이번엔 미일 비해 비교적 정확제9호 태풍 마이삭’이 휩쓸고 간 경남 양산 에덴밸리리조트 인근 풍력발전기가 3일 강풍을 견디지 못해 쓰러져 있다 이번 태풍으로 전국 29만4169가구가 정전 피해를 입었고 4명의 사상자가 발생했다 연합뉴스세계 각국의 기상청 예보를 일반인도 손쉽게 비교하는 시대가 되면서 기상청의 예보 능력이 시험대에 오른 가운데 한국 기상청이 최근 한반도에 영향을 미친 태풍들에 대해서는 미국일본 기상청에 비해 비교적 정확한 예측을 내놓은 것으로 나타났다기상청에 따르면 3일 오전 2시20분쯤 부산 남서쪽 해안에 상륙한 제9호 태풍 마이삭’은 이날 오전 6시30분쯤 강원도 강릉 인근 남쪽 동해 앞바다로 빠져나간 것으로 확인됐다 기상청이 1일 오전 10시 “마이삭이 3일 새벽 전후 경남 남해안에 상륙 동쪽 지방을 지나 오전 중 동해안 인근 해상으로 진출하겠다”고 예상한 진로에 비해 실제 상륙 위치나 상륙진출 시점이 크게 다르지 않다태풍 마이삭’이 휩쓸고 간 3일 오후 부산 수영구 민락수변공원에 바위가 굴러와 있다 이 공원에는 매미’ 등 대형 태풍이 찾아올 때마다 바위가 떠내려온다 연합뉴스마이삭의 진로는 미국일본 기상청 예보보다 한국 기상청 예측이 더 정확했다는 평가다 미국 합동태풍경보센터JTWC는 지난 1일 마이삭이 남해안에 상륙한 뒤 우리나라 중앙을 관통할 것이라는 전망을 내놨다 일본 기상청도 마이삭이 전남 지역에 상륙할 것으로 예측했었다제8호 태풍 바비’의 진로 예측에서도 한국 기상청이 비교적 더 정확했었다 기상청은 지난달 24일 오전 10시 “바비가 26일 제주도 서쪽 해상을 지나 서해안을 따라 북상한 뒤 27일 오전 9시쯤 백령도 동북동쪽 부근 육상에 상륙하겠다”고 전망했었다 반면 일본 기상청과 미국 JTWC는 나란히 바비가 황해도보다 북쪽인 신의주 부근에 상륙할 것으로 내다봤지만 바비는 한국 기상청 예측대로 27일 오전 5시30분쯤 황해도 옹진반도에 상륙했었다기상청은 태풍이 국가 재난사태에 밀접한 만큼 일반 기상현상보다 예보 역량을 특히 집중시키고 있다고 밝혔다 기상청 관계자는 “정확한 예측을 위해 태풍 발생 시 업무를 더 집중하는 경향이 있다”고 설명했다 기상청은 태풍을 전문적으로 다루는 국가태풍센터’를 별도로 산하에 두고 있다제9호 태풍 마이삭’이 휩쓸고 간 3일 부산 해운대구의 한 자동차 전시장 유리창이 산산조각 나 있다 부산최현규 기자반면 지난 장마에는 부정확한 예보로 불만과 원성을 샀다 일부 지역에선 당일 예보도 틀려 “실시간 중계라도 제대로 해라”는 비아냥을 듣기도 했다 이에 체코의 윈디’ 등 유럽 국가의 기상청과 예보 업체를 찾는 이른바 기상 망명족’이 늘기도 했다 정세균 국무총리가 지난달 9일 “기상예보 공급자인 기상청과 수요자인 홍수통제소 환경부 등이 함께 세밀하게 평가해 예보 적중률을 높여야 한다”고 주문하기도 했다한편 올 들어 우리나라에 가장 큰 영향을 미친 마이삭 이후 북상 중인 제10호 태풍 하이선’도 다음 주 우리나라를 지나갈 것으로 예상돼 피해가 우려된다 기상청은 서해상으로 이동한 바비나 동해안남부지방 일부를 훑은 마이삭과 달리 하이선은 오는 7일 남해안에 상륙한 뒤 우리나라 내륙을 남북으로 길게 가로질러 북한에 도달하는 경로가 유력하다고 전망하고 있다김지애 기자 amorkmibcokr 네이버에서 국민일보를 구독하세요클릭 국민일보 홈페이지 바로가기GoodNews paper ⓒ 국민일보wwwkmibcokr 무단전재 및 재배포금지,https://news.naver.com/main/ranking/read.nhn?mid=etc&sid1=111&rankingType=popular_day&oid=005&aid=0001358756&date=20200904&type=1&rankingSectionId=103&rankingSeq=5
북한 원산 시내 ‘마이삭’에 완전 침수됐다…조선중앙TV 방송,태풍 마이삭이 집어삼킨 北 원산 시내가 강으로 변했다태퐁 마이삭’이 동반한 폭우로 인해 북한 원산 시내가 완전히 물에 잠긴 모습을 조선중앙TV가 보도했다  3일 오전 6시 북한 원산에서 조선중앙TV 취재기자가 태풍 영향 소식을 전하는 모습 침수된 지역은 원산시내 중심인 해안광장으로 보인다 조선중앙TV 화면 캡처연합뉴스조선중앙TV는 3일 오전 6시쯤 실시간으로 원산 시내의 상황을 내보냈다 시내의 도로가 흙탕물에 뒤덮여 큰 강과 같은 모습으로 변했다 넓은 광장을 둘러싼 아파트와 주석단 건물 가로수 주위도 물이 찬 모습이다 방송은 “태풍 9호의 특징은 바람보다 강수량이 많은 것”이라며 “원산에 새벽 3∼6시 132㎜의 강한 폭우가 집중적으로 내렸고 2일 21시부터 3일 6시까지 내린 강수량은 200㎜에 달한다”고 전했다  북한 조선중앙TV는 3일 제9호 태풍 마이삭 북상 소식을 새벽 방송으로 전하며 기민한 대응을 보이고 있다 조선중앙TV 캡쳐연합뉴스해수면도 기존보다 77㎝ 높아졌다 같은 시각 함경남도 함흥시에 있는 취재 기자는 “서호마전 해안가 지역에 50㎝의 해일 현상이 나타나고 있다”며 “일부 도로가 물에 침수돼 차들이 운행하기 힘들 정도”라고 설명했다  문병주 기자 moonbyungjoojoongangcokr넌 뉴스를 찾아봐 난 뉴스가 찾아와 그래서 팩트가 뭐야 궁금하면 팩플 세상 쉬운 내 돈 관리 그게머니ⓒ중앙일보httpsjoongangcokr 무단 전재 및 재배포 금지,https://news.naver.com/main/ranking/read.nhn?mid=etc&sid1=111&rankingType=popular_day&oid=025&aid=0003031849&date=20200904&type=1&rankingSectionId=103&rankingSeq=1
