Title,Contents,link
"가을태풍 악몽···하이선 강풍반경 520㎞, 日 지나도 韓 친다",  제9호 태풍 마이삭이 지나간 3일 오전 여수시 국동항에 피항한 선박이 떠나지 못하고 제10호 태풍 하이선에 대비하고 있다 연합뉴스올해 첫 가을태풍이자 제10호 태풍 하이선’Haishen이 7일 오전 경남을 시작으로 전국에 큰 타격을 줄 것으로 전망되는 가운데 하이선 이후에도 발생할 가을태풍에 대한 우려가 크다  앞서 3일 낮까지 내륙에 제9호 태풍 마이삭’Maysak이 영향을 미쳤으나 이 태풍은 가을태풍’으로 분류되지 않는다 기상청은 매해 가을철을 911월로 보고 있는데 태풍 발생시기가 911월에 포함돼야 가을태풍’으로 판단한다  기상청 관계자는 “마이삭이 13일 내륙에 영향을 미쳤지만 발생은 지난달 28일이기 때문에 올여름 마지막 태풍’으로 봐야 할 것”이라고 덧붙였다  여름이 태풍과 장마의 계절’로 꼽혔으나 점차 가을 태풍이 늘어나고 있다 지난해에는 910월에 링링 타파 미탁 3개 태풍이 내륙에 직접적 영향을 끼쳤고 모두 인적물적 피해가 막심할 만큼 큰 타격을 줬다 특히 미탁은 10월초 남부 내륙 전반을 휩쓸면서 1000억원이 넘는 재산상 피해를 야기했다  이번 하이선의 경우 미탁보다 더 큰 타격이 예상된다는 관측이다 미탁은 내륙에 닿기 전 가장 영향이 셌을 때인 지난해 9월30일 오후 4시 통보문에서 중심부근 최대풍속 초속 35㎧시속 126㎞h에 중심기압이 970h㎩헥토파스칼에 강도 중으로 파악됐다 반면 하이선은 우리 내륙에 영향을 미치기 전인 6일 오전 9시 최대풍속이 초속 53㎧시속 191㎞h까지 빨라지며 중심기압도 920h㎩ 수준으로 비교우위에 있기 때문이다  강풍 반경도 당시 320㎞와 비교해 하이선 최대 강풍반경은 520㎞까지 예상된다이런 반경은 일본 규슈지방 최남단 가고시마에서 부산까지 직선거리가 450㎞ 안팎인 점을 감안하면 일본을 지나칠 때부터 태풍 직접 영향권에 드는 셈이다 제10호 태풍 하이선이 3일 오후 3시 기준 괌 북서쪽 약 1천100㎞ 부근 해상에서 시속 22㎞의 속도로 서북서진 중이라고 기상청이 밝혔다하이선은 오는 7일께 우리나라 남해안 부근에 상륙한 뒤 대구 춘천 부근 지역을 지나며 한반도 중앙을 남에서 북으로 관통하는 것이 현재 가장 가능성이 큰 이동 경로다사진은 3일 오후 3시 기준으로 공개된 태풍 하이선 예상 이동 경로 사진 기상청 제공전문가들은 최근 태풍이 한반도를 자주 찾는 이유를 지구 온난화’에서 찾는다 태풍태평양 허리케인대서양 사이클론인도양 같은 열대성 저기압은 해수온도가 높을 때 쉽게 생긴다 해수온도가 높아지면 바닷물이 증발해 만들어지는 수증기에서 에너지를 얻어 열대성 저기압이 쉽게 형성된다  기상청도 2019년 기후보고서’에서 잦은 태풍의 원인을 필리핀 동쪽 해상의 높은 해수면 온도로 북태평양고기압이 수축하지 않고 팽창하면서 한반도가 태풍의 길목에 위치하게 됐다고 분석했다배재성 기자 hongdoyajoongangcokr넌 뉴스를 찾아봐 난 뉴스가 찾아와 그래서 팩트가 뭐야 궁금하면 팩플 세상 쉬운 내 돈 관리 그게머니ⓒ중앙일보httpsjoongangcokr 무단 전재 및 재배포 금지,https://news.naver.com/main/ranking/read.nhn?mid=etc&sid1=111&rankingType=popular_day&oid=025&aid=0003032208&date=20200904&type=1&rankingSectionId=102&rankingSeq=3
"""맛집, 알고보니 PC방"" 음식에 PC까지 배달…문닫힌 PC방 눈물의 '생존기'",입소문 타고 호황경쟁 치열해 쉽지 않다는 의견도PC방 컴퓨터 집으로 배달하는 서비스도 생겨나배달의민족에 입점한 PC방들캡처© 뉴스1© 뉴스1서울뉴스1 정윤경 기자  신종 코로나바이러스 감염증코로나19 재확산 여파로 정부가 PC방 등 소상공인 업장에 영업중단 조치를 취한 가운데 일부 PC방 업주가 음식 배달에 나서는 등 활로 찾기에 안간힘이다 3일 관련 업계에 따르면 PC방 업주사이에 배달음식 서비스를 제공하려는 움직임이 확산하고 있다 현재 PC방 업주들은 관련 카페에서 배달업에 관한 정보 공유에 분주하다 PC방의 경우 임대료와 전용선 비용 등 영업을 하지 않더라도 고정적으로 나가는 비용이 있는 만큼 업주들은 한시적이지만 PC방 음식 배달을 통해서라도 최대한 피해를 줄여보겠단 계획이다각종 음식을 조리해 판매하는 카페형 PC방의 경우 휴게음식점 허가를 받아야 하는 만큼 배달 서비스가 가능하다 이 때문에 PC방에서 삼겹살에 피자와 파스타를 먹는 풍경은 새롭지 않게 됐다경기도에서 한식을 팔고 있는 한 PC방의 경우 배달의 민족 맛집랭킹에 올라있을 정도로 인기가 많다 이 곳은 현재 48점의 평점과 약 1200개의 리뷰가 달려있다 언뜻보면 한식 전문 음식점 같은 이곳의 사업자 정보란을 들여다보면 상호명은 OOO PC방이다매장 안에 또 다른 매장을 만들어 상품을 판매하는 숍인숍 형태로 이 곳을 운영 중인 박정빈씨39여는 찌개가 맛있다는 PC방 이용자들의 말에 지난해 10월부터 배달을 시작했다당시에는 하루에 한 두 건 정도 밖에 없던 주문량은 코로나19 이후 주문량이 급격하게 늘며 PC방 영업을 못하고 있는 현재는 정상 영업을 할 때 만큼의 수준으로 매출을 올리고 있다 박씨는 PC방 운영만으론 장사하기가 쉽지 않을 거란 생각에 시작했는데 다행히 PC방 이용자들의 입소문을 타 장사가 잘 되고 있다며 현재 가맹점도 30개 넘게 생겨났다고 말했다그는 코로나19가 빨리 끝나고 그 이전으로 돌아가면 좋겠지만 어떻게든 되겠지란 생각으로 가만히 있는 것은 위험하다며 안좋을 때를 대비해 대첵을 세우는 것이 중요하다고 말했다인천에서 2년째 PC방을 운영중인 김모씨31의 경우 코로나19로 손님이 줄며 지난 6월부터 배달을 시작했다 배달의민족에 입점한 이 PC방은 48점의 높은 평점과 200개가 넘는 리뷰로 호평을 받고 있지만 뛰어든지 얼마되지 않은 탓에 현실은 녹록지 않다그는 음식을 팔아 매출 피해를 줄여보려고 노력은 하지만 쉽지 않은 상황이라며 정상영업을 했을 때에 비하면 체감상 5 정도의 매출이 나오고 있다고 토로했다이어 사회적 거리두기가 25단계로 격상된 지금은 음식점 대부분이 다 배달에 뛰어들어 이전보다도 음식 판매가 쉽지 않다고 덧붙였다© 뉴스1PC방의 고사양 컴퓨터를 집으로 배달해주는 곳도 생겨났다PC방 업주들로 구성된 이 곳은 희망 설치일과 주소 등을 입력하면 기간과 컴퓨터 사양에 맞춰 고사양 PC를 대여할 수 있다 현재 서울성남수원구리안양의 지역을 대상으로 서비스 중이며 설치도 지원해주고 있다15일간 이용할 경우 본체 기준 12만5000원14만원에 대여할 수 있으며 30일 이용은 21만5000원25만원에 대여가 가능하다 모니터 역시 추가 비용을 내고 대여 가능하다지난 19일부터 정부는 사회적 거리두기 2단계를 시행하고 PC방과 유흥시설 노래방 등 고위험시설 12종의 운영을 금지했다 PC방 영업 중단은 원래 지난달 30일까지였으나 코로나19 확진자가 계속 늘어나자 명령해제시까지로 무기한 연기 됐다vvnews1kr 네이버 메인에서 뉴스1 구독하기  뉴스1 바로가기코로나19 뉴스 © 뉴스1코리아news1kr 무단 전재 및 재배포 금지,https://news.naver.com/main/ranking/read.nhn?mid=etc&sid1=111&rankingType=popular_day&oid=421&aid=0004852221&date=20200904&type=1&rankingSectionId=105&rankingSeq=2
[속보]美증시 급락에 亞증시 선물 일제 하락,본문 내용이 없는 기사입니다 네이버 메인에서 뉴스1 구독하기  뉴스1 바로가기코로나19 뉴스 © 뉴스1코리아news1kr 무단 전재 및 재배포 금지,https://news.naver.com/main/ranking/read.nhn?mid=etc&sid1=111&rankingType=popular_day&oid=421&aid=0004852408&date=20200904&type=0&rankingSectionId=104&rankingSeq=5
"[이슈IN] 조두순 출소 D-100…누리꾼 ""악의 귀환 막아달라""",아동 성범죄자의 대명사인 조두순이 곧 사회로 나온다 지난 2008년 8살 여아를 잔인하게 성폭행한 조두순의 출소일이 4일 기준으로 100일 남았다 아직도 그에 대한 국민적인 분노와 공포의 감정이 채 가시지 않은 상태에서 출소가 임박하자 우려의 목소리가 커지고 있다조두순 사건을 모티브로 제작된 영화 소원’ 스틸컷 네이버영화조두순은 징역 12년 만기를 채우고 오는 12월13일 출소할 예정이다 조두순의 출소일이 다가오면서 청와대 국민청원 게시판에는 걱정 어린 호소가 이어지고 있다 지난달 27일 청와대 국민청원게시판에는 올해 12월 13일 모두의 공포 대상인 조두순의 출소일을 막아주세요’라는 청원이 올라왔다 이 청원은 4일 오전 1시 30분 기준 1580여명의 동의를 받았다게시글에서 청원인은 “곧 아동 성폭행범 조두순이 출소하는데 한 아이의 인생을 망쳐놓고도 고작 12년형”이라며 “조두순이 출소해 제2의 아동 피해자가 생길지도 모른다 조두순의 출소를 제발 막아달라”고 호소했다청와대 국민청원 게시판 갈무리조두순의 범행 국민감정에 분노의 불을 지르다지난 2008년 12월 11일 조두순은 등교하던 8세 여아를 상대로 성폭행을 저질렀다 피해 어린이는 장기 일부를 잃을 정도로 크게 다쳤고 잔혹한 범죄에 국민들은 분노로 치를 떨었다하지만 1심 법원은 조두순이 술에 취해 기억하지 못한다’는 점 등을 감안해 당시 형법상 유기징역형 상한인 15년에서 3년을 감한 징역 12년을 선고했다 검찰이 항소하지 않아 형은 그대로 확정됐다 오히려 조두순은 형이 무겁다며 대법원까지 재판을 끌고 갔고 검찰은 나중에야 잘못 판단했다고 사과했다여론은 들끓었다 어린아이를 상대로 저지른 끔찍한 성범죄라는 점 범행 수법이 매우 잔인하다는 점 주취감경으로 저지른 죄에 비해 죗값이 적게 선고됐다는 점에서 논란과 공분이 일었다달아오른 청와대 국민청원 게시판하지만 법원의 판결은 끝나버렸다 답답했던 국민들은 신설된 청와대 국민청원 게시판으로 달려갔다 2017년 9월 6일 올라온 조두순 출소 반대’ 청원에는 약 61만5000여명이 동의했다 폭발적인 반응이었다청와대 유튜브 갈무리이에 2017년 12월 당시 조국 민정수석이 조두순 출소 반대 청원과 주취 감경 폐지 청원에 관해 이야기를 전했다 하지만 판결이 확정된 사건에 대해 다시 공소를 제기할 수 없다는 일사부재리 원칙’에 따라 현행법상 재심 청구가 불가능하다는 답변이 나왔다청와대의 답변이 이뤄졌음에도 1년 후인 2018년 10월에 같은 내용의 청원이 올라와 26만1000여명의 동의를 받았다 올해 역시 조두순 출소를 앞두고 청원은 계속 이어지고 있는 형편이다 지금까지 조두순에 관한 청와대 국민청원은 모두 6800여건이 올라왔다 그만큼 조두순에 대한 사회적 분노가 크고 재범에 대한 우려가 높다는 의미다조두순이 반성하지 않는 것도 여론에 기름을 부었다 2017년 언론에 공개된 조두순의 탄원서에는 나는 착한 사람입니다 절대로 짐승도 하지 않는 파렴치한 짓을 일삼는 저주받은 인간이 아닙니다 술이 깨고 나면 아무것도 기억하지 못합니다라고 적었다조두순이 일으킨 나비효과2017년 국민청원 답변 방송 청와대 유튜브 갈무리조두순의 범행으로 인한 사회적 파장은 컸다 사건 이후 관련법이 손질됐는데 유기징역형 상한은 15년에서 30년으로 높아졌다 가중처벌할 경우 형량은 최대 50년까지 허용된다 또한 13세 미만의 미성년자를 강간하는 경우에는 성폭력범죄의 처벌 등에 관한 특례법이 적용돼 무기징역 또는 10년 이상의 징역에 처하게 된다 형량이 무척 강화된 것이다또한 조두순의 출소가 임박하면서 재범을 막기 위한 다양한 조치가 이뤄진다 조두순은 사회에 나오더라도 전자발찌를 7년간 착용해야 하고 5년간 성범죄자 알림e를 통해 얼굴 등 각종 신상 정보가 공개된다 또한 법무부의 조두순 출소 후 재범방지 대책’을 보면 △1대1 전담 관제요원의 24시간 상시 모니터링 △개별심리치료 △사회적응력 강화를 위한 재사회화 프로그램 실시 등의 대책이 포함돼 있다하지만 조두순의 최근 얼굴이 확실히 공개되지 않은 상황이라 시민들의 불안감은 사라지지 않고 있다 그가 복수심을 품고 또 다른 범죄를 저지르고자 마음 먹을까 우려하는 목소리도 끊이지 않는다 특히 그가 사회 적응에 실패하거나 감시가 제대로 이뤄지지 않을 경우 실제적인 피해가 발생할 수 있다는 우려는 그 가능성만으로도 공포감을 자극하고 있다동일 범죄 막을 확실한 대책이 필요출소 후 철저한 감독이 중요하지만 사정은 여의치 않다 전자발찌만으로는 안심하기 어렵다는 반응도 있다 2008년 전자감독 제도 시행 이후 전자발찌 착용자는 20배 넘게 늘어났지만 전담인력 증원은 턱없이 모자랐다 현재는 전담인력 230여명이 3000명이 넘는 전자발찌 착용자를 관리하고 있다특히 미성년자를 대상 성범죄자 중 재범 가능성이 높은 이들을 출소 후 1대1로 24시간 감시하는 일명 조두순법’이 지난해 4월 통과되면서 인력난은 더욱 가중되고 있다 24시간 전담하려면 전자발찌 부착자 1명당 보호관찰관 4명이 있어야 하는데 현재 인력으로는 운영이 어려운 형편이다조두순의 출소를 앞두고 아동 성범죄자를 아예 사회에서 격리하자는 의견도 나왔다 김영호 더불어민주당 의원은 지난달 26일 13세 미만 미성년자 대상 성폭력 범죄의 종신형 선고에 관한 특별법’ 개정안을 대표 발의했다이 개정안에 따르면 조두순이 출소 후 강간 또는 강제추행 범죄를 또다시 저지르면 사망 때까지 가석방이 불가능한 종신형에 처할 수 있게 된다 현재는 무기징역을 선고받아도 일정 요건을 갖추면 가석방의 기회가 주어진다 수감 태도 등에 따라 가석방될 가능성을 아예 차단한다는 것에 의의가 있다김 의원은 “아동청소년 대상 성범죄 처벌 수위는 국민 눈높이보다 턱없이 낮은 수준”이라며 “상습적 아동성범죄자에 대한 가중처벌을 시급히 제도화해야 한다”고 말했다김명상 기자terrybloternet블로터 바로가기  네이버 메인에서 블로터 뉴스 구독하기  블로터 아카데미에서 마케팅 역량을 키우세요  확장 가능 애자일 조직 디지털 성장의 핵심동력  저작권자 ⓒ주블로터앤미디어 무단 전재 및 재배포 금지,https://news.naver.com/main/ranking/read.nhn?mid=etc&sid1=111&rankingType=popular_day&oid=293&aid=0000030728&date=20200904&type=1&rankingSectionId=105&rankingSeq=4
"의료계, 단일협상안 만장일치 의결… 집단휴진·3차 총파업은 그대로",7일 3차 총파업’ 전까지 논의“의료현장 필수인력 투입 검토” 강경일변도서 한발 물러선 모습 정부 “이번엔 합의 이뤄지길 기대” 여야 관련 특위 구성 잠정 합의3일 서울 서초구 가톨릭대학교 서울성모병원 본관에서 교수들이 전공의와 전임의들을 지지하는 피켓 시위를 하고 있다 연합뉴스의대 정원 확대 등에 반대해 집단휴진을 벌여온 의료계가 단일 요구안을 도출했다 의료계는 이를 바탕으로 오는 7일 의협이 예고한 3차 전국의사 총파업 전까지 국회 정부와 집중 협상을 진행하기로 했다  4대악 저지투쟁 특별위원회범투위’는 3일 오후 비공개회의를 열고 만장일치로 내부 단일 협상안을 도출했다 범투위는 대한의사협회의협를 중심으로 전공의 전임의 의과대학생으로 꾸려진 젊은의사 비상대책위원회 등이 참여하고 있다 젊은의사 비대위는 전날 의협 집행부와 단일 협상안에 대해 이견을 조율한 데 이어 범투위에서 추가 논의를 진행했다  김대하 의협 대변인은 “투쟁에 가장 적극적으로 나서고 있는 젊은의사의 요구안을 범투위에서 받았고 그 내용을 반영해 의료계 단일안을 도출했다”며 “이른 시일 내 요구안을 가지고 정부 및 국회와 대화를 시작하겠다”고 말했다  다만 현재 진행 중인 전공의 전임의 집단휴진이나 7일로 예고된 전국의사총파업 계획에는 아직 변화가 없다고 밝혔다 김 대변인은 “이날 도출된 안건은 정부와의 합의가 아니라 의료계가 정부 여당과 대화하려는 합의안”이라며 “7일 이전까지 최대한 적극적으로 성실하게 대화에 임할 것”이라고 밝혔다 여당과 사전 조율이 완료됐느냐에 대해서는 확인해 줄 수 없다면서도 대화 자체는 긍정적이었다고 평가했다  앞서 지난달 26일 의협 2차 총파업을 앞두고 의대 정원 확대 정책을 중단’하겠다는 정부 제안에 대해 전공의 측이 철회’를 명문화해야 한다며 반대해 합의가 어그러진 바 있다 단일안으로 의료계와 정부국회가 대화에 나서면 해결의 실마리도 찾을 수 있을 것으로 기대된다 서울 용산구 대한의사협회 회의장 앞에서 김대하 대변인이 취재진의 질문에 답하고 있다 연합뉴스젊은의사 비대위는 이날 의료 현장 필수인력 투입을 검토하겠다는 입장을 내놓는 등 강경일변도 태도에서 한발 물러선 모습을 보였다 젊은의사 비대위는 홈페이지 공지사항을 통해 “응급실 중환자실 투석실 등 필수인력 투입에 대한 필요성을 인지하고 있다”며 “전국의과대학교수협의회와 함께 장기화된 단체행동에 대처하기 위해 필수인력 재조정에 대해 모든 가능성을 열어놓고 검토하도록 하겠다”고 밝혔다  이날 서울아산병원 전공의 비상대책위원회는 원내 코로나19가 발생함에 따라 필수 의료 분야에 자발적으로 복귀하기로 했다  정부 국회는 의료계와의 협상에 대비하고 있다 여야는 이날 의사 파업사태 논의를 위한 국회 특위를 구성키로 잠정 합의했다 더불어민주당 김태년 원내대표는 정책조정회의에서 “의료계가 제기하는 여러 문제를 다 포함한 논의를 하기 위해 국회 공공의료 확충 지역의료 격차 해소를 위한 특위를 국회 내에 구성하기로 했다”고 밝혔다 구성 방식에 대해서는 아직 여야가 논의 중인 가운데 여야정 및 의사가 모두 참여하는 안이 유력한 것으로 전해졌다  민주당 한정애 정책위의장은 “우리 당의 원점에서 검토하겠다’는 입장은 유효하다”며 “범투위에서 진전된 협상안이 도출되면 현재 의료계에 내려진 행정처분 등 우리가 할 수 있는 범위 내에서 최대한 적절한 처리방안이 마련되도록 논의할 것”이라며 “국회 내 특위 구성을 통해서 전달체계 개편 수련환경 개편 지역 가산수가의 신설 등 의료체계 개선에 대해 열린 마음으로 논의할 것을 약속한다”고 강조했다 더불어민주당 한정애 신임 정책위의장 연합뉴스보건복지부는 범투위가 아직 공식적으로 요구안을 제안하지 않았다면서도 이번만큼은 합의가 이뤄지길 기대했다 복지부 관계자는 “의료계가 받아들인다면 이를 존중하고 성실하게 합의 내용을 지켜갈 것”이라고 밝혔다  갈등을 봉합할 시간이 많지는 않다 정부는 지난 1일 시행하기로 했던 의사국가시험을 8일로 연기했다 시험 응시를 원하는 의대생은 4일 오후 6시까지 재신청해야 한다 합의를 이루지 못하면 의협은 오는 7일부터 3차 무기한 총파업을 벌이겠다고 예고한 상태다  참여연대는 이날 논평을 내고 “협상이 의료계의 민원을 해결하는 창구가 되어서는 안 된다”며 “의료 공공성의 확대를 위해 시민이 함께하는 사회적 논의의 장을 마련해야 한다”고 밝혔다 이어 “수도권과 지방의 극심한 의료 불평등과 격차를 개선하기 위해 이번 정부안의 정책 방향은 미룰 수 없는 시대적 과제”라며 “의사 늘리기 공공의대 설립 등은 흔들림 없이 실행돼야 한다”고 강조했다이진경최형창이강진 기자 ljinsegyecomⓒ 세상을 보는 눈 세계일보,https://news.naver.com/main/ranking/read.nhn?mid=etc&sid1=111&rankingType=popular_day&oid=022&aid=0003500192&date=20200904&type=1&rankingSectionId=102&rankingSeq=5
"알몸에 수갑, 복면 씌워진 흑인…이번엔 '질식사' 파문",앵커미국에서 흑인 남성이 숨진 또 다른 사건이 알려졌습니다 이번엔 알몸으로 수갑을 찬 채 백인 경찰에 제압을 당한 뒤에 숨졌습니다 그 모습이 담긴 영상이 6개월 만에 공개됐습니다워싱턴에서 임종주 특파원입니다기자41살 흑인 남성 대니얼 프루드가 경찰 지시에 따라 땅에 엎드립니다뉴욕주 로체스터 경찰  땅에 엎드려요 땅에 엎드리고 손은 등 뒤로 올려요이어 벌거벗은 채로 수갑이 채워집니다뉴욕주 로체스터 경찰  움직이지 말아요 움직이지 말고 예침이 튀는 것을 막는 코로나19 감염 방지용 복면도 뒤집어씌웁니다프루드가 코로나 바이러스에 걸렸다며 돌아다녔다는 이유에서입니다지난 3월 23일 새벽 경찰 무릎에 목 눌려 숨진 조지 플로이드 사건 두 달 전이었습니다눈발이 날릴 정도로 추운 날씨에 아스팔트 위에서 있었던 일입니다프루드가 일어서려 하자 경찰이 다시 주저앉혀 머리를 짓누릅니다2분쯤 뒤 프루드는 의식을 잃었고 일주일 만에 숨졌습니다경찰 몸에 부착된 보디캠 영상은 유족 요구에 따라 6개월 만에 공개된 것입니다피해자가 정신 건강에 문제가 있다는 가족의 도움 요청을 받고 경찰이 출동한 직후부터 모든 상황이 녹화됐습니다부검 결과 사망 원인은 질식에 의한 살인이었습니다조 프루드피해자 형  경찰이 제 동생을 쓰레기 취급한 것입니다 쓰레기는 어떻게 합니까 그냥 버리잖아요 경찰이 제 동생을 그렇게 한 것입니다사건이 공개되면서 격렬한 항의 시위가 시작됐습니다경찰은 은폐 의혹을 부인했고 뉴욕주 법무부가 수사에 착수했습니다이번 사건은 인종차별 항의 시위에 또 한 번 기름을 부었습니다두 달도 채 남지 않은 미 대선 정국에서 가장 큰 쟁점 중 하나입니다임종주 기자 limjongjujoinscom 영상편집 강경아 시청자와 함께 JTBC 뉴스 제보하기 뉴스의 뒷이야기 JTBC 취재설명서Copyright by JTBChttpjtbcjoinscom All Rights Reserved 무단 전재 및 재배포 금지,https://news.naver.com/main/ranking/read.nhn?mid=etc&sid1=111&rankingType=popular_day&oid=437&aid=0000246780&date=20200904&type=2&rankingSectionId=104&rankingSeq=3
